Site,Parameter,Date (LST),Year,Month,Day,Hour,Value,Unit,Duration,QC Name
Shanghai,PM2.5,1/1/14 00:00,2014,1,1,0,136,µg/m_,1 Hr,Valid
Shanghai,PM2.5,1/1/14 01:00,2014,1,1,1,173,µg/m_,1 Hr,Valid
Shanghai,PM2.5,1/1/14 02:00,2014,1,1,2,166,µg/m_,1 Hr,Valid
Shanghai,PM2.5,1/1/14 03:00,2014,1,1,3,157,µg/m_,1 Hr,Valid
Shanghai,PM2.5,1/1/14 04:00,2014,1,1,4,157,µg/m_,1 Hr,Valid
Shanghai,PM2.5,1/1/14 05:00,2014,1,1,5,147,µg/m_,1 Hr,Valid
Shanghai,PM2.5,1/1/14 06:00,2014,1,1,6,154,µg/m_,1 Hr,Valid
Shanghai,PM2.5,1/1/14 07:00,2014,1,1,7,142,µg/m_,1 Hr,Valid
Shanghai,PM2.5,1/1/14 08:00,2014,1,1,8,137,µg/m_,1 Hr,Valid
Shanghai,PM2.5,1/1/14 09:00,2014,1,1,9,138,µg/m_,1 Hr,Valid
Shanghai,PM2.5,1/1/14 10:00,2014,1,1,10,121,µg/m_,1 Hr,Valid
Shanghai,PM2.5,1/1/14 11:00,2014,1,1,11,100,µg/m_,1 Hr,Valid
Shanghai,PM2.5,1/1/14 12:00,2014,1,1,12,81,µg/m_,1 Hr,Valid
Shanghai,PM2.5,1/1/14 13:00,2014,1,1,13,75,µg/m_,1 Hr,Valid
Shanghai,PM2.5,1/1/14 14:00,2014,1,1,14,78,µg/m_,1 Hr,Valid
Shanghai,PM2.5,1/1/14 15:00,2014,1,1,15,71,µg/m_,1 Hr,Valid
Shanghai,PM2.5,1/1/14 16:00,2014,1,1,16,79,µg/m_,1 Hr,Valid
Shanghai,PM2.5,1/1/14 17:00,2014,1,1,17,84,µg/m_,1 Hr,Valid
Shanghai,PM2.5,1/1/14 18:00,2014,1,1,18,100,µg/m_,1 Hr,Valid
Shanghai,PM2.5,1/1/14 19:00,2014,1,1,19,106,µg/m_,1 Hr,Valid
Shanghai,PM2.5,1/1/14 20:00,2014,1,1,20,142,µg/m_,1 Hr,Valid
Shanghai,PM2.5,1/1/14 21:00,2014,1,1,21,163,µg/m_,1 Hr,Valid
Shanghai,PM2.5,1/1/14 22:00,2014,1,1,22,171,µg/m_,1 Hr,Valid
Shanghai,PM2.5,1/1/14 23:00,2014,1,1,23,163,µg/m_,1 Hr,Valid
Shanghai,PM2.5,1/2/14 00:00,2014,1,2,0,174,µg/m_,1 Hr,Valid
Shanghai,PM2.5,1/2/14 01:00,2014,1,2,1,182,µg/m_,1 Hr,Valid
Shanghai,PM2.5,1/2/14 02:00,2014,1,2,2,160,µg/m_,1 Hr,Valid
Shanghai,PM2.5,1/2/14 03:00,2014,1,2,3,132,µg/m_,1 Hr,Valid
Shanghai,PM2.5,1/2/14 04:00,2014,1,2,4,116,µg/m_,1 Hr,Valid
Shanghai,PM2.5,1/2/14 05:00,2014,1,2,5,114,µg/m_,1 Hr,Valid
Shanghai,PM2.5,1/2/14 06:00,2014,1,2,6,99,µg/m_,1 Hr,Valid
Shanghai,PM2.5,1/2/14 07:00,2014,1,2,7,95,µg/m_,1 Hr,Valid
Shanghai,PM2.5,1/2/14 08:00,2014,1,2,8,77,µg/m_,1 Hr,Valid
Shanghai,PM2.5,1/2/14 09:00,2014,1,2,9,81,µg/m_,1 Hr,Valid
Shanghai,PM2.5,1/2/14 10:00,2014,1,2,10,101,µg/m_,1 Hr,Valid
Shanghai,PM2.5,1/2/14 11:00,2014,1,2,11,88,µg/m_,1 Hr,Valid
Shanghai,PM2.5,1/2/14 12:00,2014,1,2,12,63,µg/m_,1 Hr,Valid
Shanghai,PM2.5,1/2/14 13:00,2014,1,2,13,-999,µg/m_,1 Hr,Missing
Shanghai,PM2.5,1/2/14 14:00,2014,1,2,14,33,µg/m_,1 Hr,Valid
Shanghai,PM2.5,1/2/14 15:00,2014,1,2,15,44,µg/m_,1 Hr,Valid
Shanghai,PM2.5,1/2/14 16:00,2014,1,2,16,73,µg/m_,1 Hr,Valid
Shanghai,PM2.5,1/2/14 17:00,2014,1,2,17,66,µg/m_,1 Hr,Valid
Shanghai,PM2.5,1/2/14 18:00,2014,1,2,18,71,µg/m_,1 Hr,Valid
Shanghai,PM2.5,1/2/14 19:00,2014,1,2,19,75,µg/m_,1 Hr,Valid
Shanghai,PM2.5,1/2/14 20:00,2014,1,2,20,76,µg/m_,1 Hr,Valid
Shanghai,PM2.5,1/2/14 21:00,2014,1,2,21,74,µg/m_,1 Hr,Valid
Shanghai,PM2.5,1/2/14 22:00,2014,1,2,22,68,µg/m_,1 Hr,Valid
Shanghai,PM2.5,1/2/14 23:00,2014,1,2,23,70,µg/m_,1 Hr,Valid
Shanghai,PM2.5,1/3/14 00:00,2014,1,3,0,71,µg/m_,1 Hr,Valid
Shanghai,PM2.5,1/3/14 01:00,2014,1,3,1,68,µg/m_,1 Hr,Valid
Shanghai,PM2.5,1/3/14 02:00,2014,1,3,2,77,µg/m_,1 Hr,Valid
Shanghai,PM2.5,1/3/14 03:00,2014,1,3,3,76,µg/m_,1 Hr,Valid
Shanghai,PM2.5,1/3/14 04:00,2014,1,3,4,76,µg/m_,1 Hr,Valid
Shanghai,PM2.5,1/3/14 05:00,2014,1,3,5,92,µg/m_,1 Hr,Valid
Shanghai,PM2.5,1/3/14 06:00,2014,1,3,6,105,µg/m_,1 Hr,Valid
Shanghai,PM2.5,1/3/14 07:00,2014,1,3,7,107,µg/m_,1 Hr,Valid
Shanghai,PM2.5,1/3/14 08:00,2014,1,3,8,124,µg/m_,1 Hr,Valid
Shanghai,PM2.5,1/3/14 09:00,2014,1,3,9,153,µg/m_,1 Hr,Valid
Shanghai,PM2.5,1/3/14 10:00,2014,1,3,10,158,µg/m_,1 Hr,Valid
Shanghai,PM2.5,1/3/14 11:00,2014,1,3,11,149,µg/m_,1 Hr,Valid
Shanghai,PM2.5,1/3/14 12:00,2014,1,3,12,164,µg/m_,1 Hr,Valid
Shanghai,PM2.5,1/3/14 13:00,2014,1,3,13,123,µg/m_,1 Hr,Valid
Shanghai,PM2.5,1/3/14 14:00,2014,1,3,14,95,µg/m_,1 Hr,Valid
Shanghai,PM2.5,1/3/14 15:00,2014,1,3,15,97,µg/m_,1 Hr,Valid
Shanghai,PM2.5,1/3/14 16:00,2014,1,3,16,110,µg/m_,1 Hr,Valid
Shanghai,PM2.5,1/3/14 17:00,2014,1,3,17,139,µg/m_,1 Hr,Valid
Shanghai,PM2.5,1/3/14 18:00,2014,1,3,18,150,µg/m_,1 Hr,Valid
Shanghai,PM2.5,1/3/14 19:00,2014,1,3,19,161,µg/m_,1 Hr,Valid
Shanghai,PM2.5,1/3/14 20:00,2014,1,3,20,190,µg/m_,1 Hr,Valid
Shanghai,PM2.5,1/3/14 21:00,2014,1,3,21,212,µg/m_,1 Hr,Valid
Shanghai,PM2.5,1/3/14 22:00,2014,1,3,22,225,µg/m_,1 Hr,Valid
Shanghai,PM2.5,1/3/14 23:00,2014,1,3,23,196,µg/m_,1 Hr,Valid
Shanghai,PM2.5,1/4/14 00:00,2014,1,4,0,208,µg/m_,1 Hr,Valid
Shanghai,PM2.5,1/4/14 01:00,2014,1,4,1,229,µg/m_,1 Hr,Valid
Shanghai,PM2.5,1/4/14 02:00,2014,1,4,2,251,µg/m_,1 Hr,Valid
Shanghai,PM2.5,1/4/14 03:00,2014,1,4,3,209,µg/m_,1 Hr,Valid
Shanghai,PM2.5,1/4/14 04:00,2014,1,4,4,189,µg/m_,1 Hr,Valid
Shanghai,PM2.5,1/4/14 05:00,2014,1,4,5,170,µg/m_,1 Hr,Valid
Shanghai,PM2.5,1/4/14 06:00,2014,1,4,6,110,µg/m_,1 Hr,Valid
Shanghai,PM2.5,1/4/14 07:00,2014,1,4,7,86,µg/m_,1 Hr,Valid
Shanghai,PM2.5,1/4/14 08:00,2014,1,4,8,80,µg/m_,1 Hr,Valid
Shanghai,PM2.5,1/4/14 09:00,2014,1,4,9,103,µg/m_,1 Hr,Valid
Shanghai,PM2.5,1/4/14 10:00,2014,1,4,10,98,µg/m_,1 Hr,Valid
Shanghai,PM2.5,1/4/14 11:00,2014,1,4,11,71,µg/m_,1 Hr,Valid
Shanghai,PM2.5,1/4/14 12:00,2014,1,4,12,68,µg/m_,1 Hr,Valid
Shanghai,PM2.5,1/4/14 13:00,2014,1,4,13,80,µg/m_,1 Hr,Valid
Shanghai,PM2.5,1/4/14 14:00,2014,1,4,14,77,µg/m_,1 Hr,Valid
Shanghai,PM2.5,1/4/14 15:00,2014,1,4,15,59,µg/m_,1 Hr,Valid
Shanghai,PM2.5,1/4/14 16:00,2014,1,4,16,61,µg/m_,1 Hr,Valid
Shanghai,PM2.5,1/4/14 17:00,2014,1,4,17,55,µg/m_,1 Hr,Valid
Shanghai,PM2.5,1/4/14 18:00,2014,1,4,18,47,µg/m_,1 Hr,Valid
Shanghai,PM2.5,1/4/14 19:00,2014,1,4,19,34,µg/m_,1 Hr,Valid
Shanghai,PM2.5,1/4/14 20:00,2014,1,4,20,28,µg/m_,1 Hr,Valid
Shanghai,PM2.5,1/4/14 21:00,2014,1,4,21,33,µg/m_,1 Hr,Valid
Shanghai,PM2.5,1/4/14 22:00,2014,1,4,22,21,µg/m_,1 Hr,Valid
Shanghai,PM2.5,1/4/14 23:00,2014,1,4,23,27,µg/m_,1 Hr,Valid
Shanghai,PM2.5,1/5/14 00:00,2014,1,5,0,29,µg/m_,1 Hr,Valid
Shanghai,PM2.5,1/5/14 01:00,2014,1,5,1,23,µg/m_,1 Hr,Valid
Shanghai,PM2.5,1/5/14 02:00,2014,1,5,2,32,µg/m_,1 Hr,Valid
Shanghai,PM2.5,1/5/14 03:00,2014,1,5,3,30,µg/m_,1 Hr,Valid
Shanghai,PM2.5,1/5/14 04:00,2014,1,5,4,33,µg/m_,1 Hr,Valid
Shanghai,PM2.5,1/5/14 05:00,2014,1,5,5,35,µg/m_,1 Hr,Valid
Shanghai,PM2.5,1/5/14 06:00,2014,1,5,6,37,µg/m_,1 Hr,Valid
Shanghai,PM2.5,1/5/14 07:00,2014,1,5,7,35,µg/m_,1 Hr,Valid
Shanghai,PM2.5,1/5/14 08:00,2014,1,5,8,28,µg/m_,1 Hr,Valid
Shanghai,PM2.5,1/5/14 09:00,2014,1,5,9,37,µg/m_,1 Hr,Valid
Shanghai,PM2.5,1/5/14 10:00,2014,1,5,10,53,µg/m_,1 Hr,Valid
Shanghai,PM2.5,1/5/14 11:00,2014,1,5,11,70,µg/m_,1 Hr,Valid
Shanghai,PM2.5,1/5/14 12:00,2014,1,5,12,91,µg/m_,1 Hr,Valid
Shanghai,PM2.5,1/5/14 13:00,2014,1,5,13,112,µg/m_,1 Hr,Valid
Shanghai,PM2.5,1/5/14 14:00,2014,1,5,14,122,µg/m_,1 Hr,Valid
Shanghai,PM2.5,1/5/14 15:00,2014,1,5,15,105,µg/m_,1 Hr,Valid
Shanghai,PM2.5,1/5/14 16:00,2014,1,5,16,87,µg/m_,1 Hr,Valid
Shanghai,PM2.5,1/5/14 17:00,2014,1,5,17,63,µg/m_,1 Hr,Valid
Shanghai,PM2.5,1/5/14 18:00,2014,1,5,18,44,µg/m_,1 Hr,Valid
Shanghai,PM2.5,1/5/14 19:00,2014,1,5,19,25,µg/m_,1 Hr,Valid
Shanghai,PM2.5,1/5/14 20:00,2014,1,5,20,27,µg/m_,1 Hr,Valid
Shanghai,PM2.5,1/5/14 21:00,2014,1,5,21,27,µg/m_,1 Hr,Valid
Shanghai,PM2.5,1/5/14 22:00,2014,1,5,22,28,µg/m_,1 Hr,Valid
Shanghai,PM2.5,1/5/14 23:00,2014,1,5,23,35,µg/m_,1 Hr,Valid
Shanghai,PM2.5,1/6/14 00:00,2014,1,6,0,26,µg/m_,1 Hr,Valid
Shanghai,PM2.5,1/6/14 01:00,2014,1,6,1,20,µg/m_,1 Hr,Valid
Shanghai,PM2.5,1/6/14 02:00,2014,1,6,2,17,µg/m_,1 Hr,Valid
Shanghai,PM2.5,1/6/14 03:00,2014,1,6,3,20,µg/m_,1 Hr,Valid
Shanghai,PM2.5,1/6/14 04:00,2014,1,6,4,21,µg/m_,1 Hr,Valid
Shanghai,PM2.5,1/6/14 05:00,2014,1,6,5,22,µg/m_,1 Hr,Valid
Shanghai,PM2.5,1/6/14 06:00,2014,1,6,6,19,µg/m_,1 Hr,Valid
Shanghai,PM2.5,1/6/14 07:00,2014,1,6,7,24,µg/m_,1 Hr,Valid
Shanghai,PM2.5,1/6/14 08:00,2014,1,6,8,24,µg/m_,1 Hr,Valid
Shanghai,PM2.5,1/6/14 09:00,2014,1,6,9,21,µg/m_,1 Hr,Valid
Shanghai,PM2.5,1/6/14 10:00,2014,1,6,10,24,µg/m_,1 Hr,Valid
Shanghai,PM2.5,1/6/14 11:00,2014,1,6,11,24,µg/m_,1 Hr,Valid
Shanghai,PM2.5,1/6/14 12:00,2014,1,6,12,24,µg/m_,1 Hr,Valid
Shanghai,PM2.5,1/6/14 13:00,2014,1,6,13,26,µg/m_,1 Hr,Valid
Shanghai,PM2.5,1/6/14 14:00,2014,1,6,14,22,µg/m_,1 Hr,Valid
Shanghai,PM2.5,1/6/14 15:00,2014,1,6,15,23,µg/m_,1 Hr,Valid
Shanghai,PM2.5,1/6/14 16:00,2014,1,6,16,39,µg/m_,1 Hr,Valid
Shanghai,PM2.5,1/6/14 17:00,2014,1,6,17,35,µg/m_,1 Hr,Valid
Shanghai,PM2.5,1/6/14 18:00,2014,1,6,18,37,µg/m_,1 Hr,Valid
Shanghai,PM2.5,1/6/14 19:00,2014,1,6,19,39,µg/m_,1 Hr,Valid
Shanghai,PM2.5,1/6/14 20:00,2014,1,6,20,39,µg/m_,1 Hr,Valid
Shanghai,PM2.5,1/6/14 21:00,2014,1,6,21,36,µg/m_,1 Hr,Valid
Shanghai,PM2.5,1/6/14 22:00,2014,1,6,22,43,µg/m_,1 Hr,Valid
Shanghai,PM2.5,1/6/14 23:00,2014,1,6,23,36,µg/m_,1 Hr,Valid
Shanghai,PM2.5,1/7/14 00:00,2014,1,7,0,42,µg/m_,1 Hr,Valid
Shanghai,PM2.5,1/7/14 01:00,2014,1,7,1,37,µg/m_,1 Hr,Valid
Shanghai,PM2.5,1/7/14 02:00,2014,1,7,2,43,µg/m_,1 Hr,Valid
Shanghai,PM2.5,1/7/14 03:00,2014,1,7,3,38,µg/m_,1 Hr,Valid
Shanghai,PM2.5,1/7/14 04:00,2014,1,7,4,41,µg/m_,1 Hr,Valid
Shanghai,PM2.5,1/7/14 05:00,2014,1,7,5,36,µg/m_,1 Hr,Valid
Shanghai,PM2.5,1/7/14 06:00,2014,1,7,6,39,µg/m_,1 Hr,Valid
Shanghai,PM2.5,1/7/14 07:00,2014,1,7,7,42,µg/m_,1 Hr,Valid
Shanghai,PM2.5,1/7/14 08:00,2014,1,7,8,38,µg/m_,1 Hr,Valid
Shanghai,PM2.5,1/7/14 09:00,2014,1,7,9,39,µg/m_,1 Hr,Valid
Shanghai,PM2.5,1/7/14 10:00,2014,1,7,10,36,µg/m_,1 Hr,Valid
Shanghai,PM2.5,1/7/14 11:00,2014,1,7,11,35,µg/m_,1 Hr,Valid
Shanghai,PM2.5,1/7/14 12:00,2014,1,7,12,38,µg/m_,1 Hr,Valid
Shanghai,PM2.5,1/7/14 13:00,2014,1,7,13,44,µg/m_,1 Hr,Valid
Shanghai,PM2.5,1/7/14 14:00,2014,1,7,14,53,µg/m_,1 Hr,Valid
Shanghai,PM2.5,1/7/14 15:00,2014,1,7,15,42,µg/m_,1 Hr,Valid
Shanghai,PM2.5,1/7/14 16:00,2014,1,7,16,46,µg/m_,1 Hr,Valid
Shanghai,PM2.5,1/7/14 17:00,2014,1,7,17,43,µg/m_,1 Hr,Valid
Shanghai,PM2.5,1/7/14 18:00,2014,1,7,18,58,µg/m_,1 Hr,Valid
Shanghai,PM2.5,1/7/14 19:00,2014,1,7,19,50,µg/m_,1 Hr,Valid
Shanghai,PM2.5,1/7/14 20:00,2014,1,7,20,59,µg/m_,1 Hr,Valid
Shanghai,PM2.5,1/7/14 21:00,2014,1,7,21,61,µg/m_,1 Hr,Valid
Shanghai,PM2.5,1/7/14 22:00,2014,1,7,22,75,µg/m_,1 Hr,Valid
Shanghai,PM2.5,1/7/14 23:00,2014,1,7,23,74,µg/m_,1 Hr,Valid
Shanghai,PM2.5,1/8/14 00:00,2014,1,8,0,73,µg/m_,1 Hr,Valid
Shanghai,PM2.5,1/8/14 01:00,2014,1,8,1,70,µg/m_,1 Hr,Valid
Shanghai,PM2.5,1/8/14 02:00,2014,1,8,2,83,µg/m_,1 Hr,Valid
Shanghai,PM2.5,1/8/14 03:00,2014,1,8,3,97,µg/m_,1 Hr,Valid
Shanghai,PM2.5,1/8/14 04:00,2014,1,8,4,31,µg/m_,1 Hr,Valid
Shanghai,PM2.5,1/8/14 05:00,2014,1,8,5,29,µg/m_,1 Hr,Valid
Shanghai,PM2.5,1/8/14 06:00,2014,1,8,6,22,µg/m_,1 Hr,Valid
Shanghai,PM2.5,1/8/14 07:00,2014,1,8,7,20,µg/m_,1 Hr,Valid
Shanghai,PM2.5,1/8/14 08:00,2014,1,8,8,25,µg/m_,1 Hr,Valid
Shanghai,PM2.5,1/8/14 09:00,2014,1,8,9,20,µg/m_,1 Hr,Valid
Shanghai,PM2.5,1/8/14 10:00,2014,1,8,10,27,µg/m_,1 Hr,Valid
Shanghai,PM2.5,1/8/14 11:00,2014,1,8,11,35,µg/m_,1 Hr,Valid
Shanghai,PM2.5,1/8/14 12:00,2014,1,8,12,34,µg/m_,1 Hr,Valid
Shanghai,PM2.5,1/8/14 13:00,2014,1,8,13,38,µg/m_,1 Hr,Valid
Shanghai,PM2.5,1/8/14 14:00,2014,1,8,14,42,µg/m_,1 Hr,Valid
Shanghai,PM2.5,1/8/14 15:00,2014,1,8,15,35,µg/m_,1 Hr,Valid
Shanghai,PM2.5,1/8/14 16:00,2014,1,8,16,36,µg/m_,1 Hr,Valid
Shanghai,PM2.5,1/8/14 17:00,2014,1,8,17,29,µg/m_,1 Hr,Valid
Shanghai,PM2.5,1/8/14 18:00,2014,1,8,18,40,µg/m_,1 Hr,Valid
Shanghai,PM2.5,1/8/14 19:00,2014,1,8,19,44,µg/m_,1 Hr,Valid
Shanghai,PM2.5,1/8/14 20:00,2014,1,8,20,36,µg/m_,1 Hr,Valid
Shanghai,PM2.5,1/8/14 21:00,2014,1,8,21,27,µg/m_,1 Hr,Valid
Shanghai,PM2.5,1/8/14 22:00,2014,1,8,22,22,µg/m_,1 Hr,Valid
Shanghai,PM2.5,1/8/14 23:00,2014,1,8,23,19,µg/m_,1 Hr,Valid
Shanghai,PM2.5,1/9/14 00:00,2014,1,9,0,22,µg/m_,1 Hr,Valid
Shanghai,PM2.5,1/9/14 01:00,2014,1,9,1,23,µg/m_,1 Hr,Valid
Shanghai,PM2.5,1/9/14 02:00,2014,1,9,2,30,µg/m_,1 Hr,Valid
Shanghai,PM2.5,1/9/14 03:00,2014,1,9,3,32,µg/m_,1 Hr,Valid
Shanghai,PM2.5,1/9/14 04:00,2014,1,9,4,31,µg/m_,1 Hr,Valid
Shanghai,PM2.5,1/9/14 05:00,2014,1,9,5,33,µg/m_,1 Hr,Valid
Shanghai,PM2.5,1/9/14 06:00,2014,1,9,6,29,µg/m_,1 Hr,Valid
Shanghai,PM2.5,1/9/14 07:00,2014,1,9,7,26,µg/m_,1 Hr,Valid
Shanghai,PM2.5,1/9/14 08:00,2014,1,9,8,35,µg/m_,1 Hr,Valid
Shanghai,PM2.5,1/9/14 09:00,2014,1,9,9,32,µg/m_,1 Hr,Valid
Shanghai,PM2.5,1/9/14 10:00,2014,1,9,10,36,µg/m_,1 Hr,Valid
Shanghai,PM2.5,1/9/14 11:00,2014,1,9,11,36,µg/m_,1 Hr,Valid
Shanghai,PM2.5,1/9/14 12:00,2014,1,9,12,39,µg/m_,1 Hr,Valid
Shanghai,PM2.5,1/9/14 13:00,2014,1,9,13,36,µg/m_,1 Hr,Valid
Shanghai,PM2.5,1/9/14 14:00,2014,1,9,14,40,µg/m_,1 Hr,Valid
Shanghai,PM2.5,1/9/14 15:00,2014,1,9,15,41,µg/m_,1 Hr,Valid
Shanghai,PM2.5,1/9/14 16:00,2014,1,9,16,44,µg/m_,1 Hr,Valid
Shanghai,PM2.5,1/9/14 17:00,2014,1,9,17,38,µg/m_,1 Hr,Valid
Shanghai,PM2.5,1/9/14 18:00,2014,1,9,18,45,µg/m_,1 Hr,Valid
Shanghai,PM2.5,1/9/14 19:00,2014,1,9,19,40,µg/m_,1 Hr,Valid
Shanghai,PM2.5,1/9/14 20:00,2014,1,9,20,36,µg/m_,1 Hr,Valid
Shanghai,PM2.5,1/9/14 21:00,2014,1,9,21,36,µg/m_,1 Hr,Valid
Shanghai,PM2.5,1/9/14 22:00,2014,1,9,22,32,µg/m_,1 Hr,Valid
Shanghai,PM2.5,1/9/14 23:00,2014,1,9,23,31,µg/m_,1 Hr,Valid
Shanghai,PM2.5,1/10/14 00:00,2014,1,10,0,28,µg/m_,1 Hr,Valid
Shanghai,PM2.5,1/10/14 01:00,2014,1,10,1,30,µg/m_,1 Hr,Valid
Shanghai,PM2.5,1/10/14 02:00,2014,1,10,2,27,µg/m_,1 Hr,Valid
Shanghai,PM2.5,1/10/14 03:00,2014,1,10,3,24,µg/m_,1 Hr,Valid
Shanghai,PM2.5,1/10/14 04:00,2014,1,10,4,30,µg/m_,1 Hr,Valid
Shanghai,PM2.5,1/10/14 05:00,2014,1,10,5,28,µg/m_,1 Hr,Valid
Shanghai,PM2.5,1/10/14 06:00,2014,1,10,6,32,µg/m_,1 Hr,Valid
Shanghai,PM2.5,1/10/14 07:00,2014,1,10,7,33,µg/m_,1 Hr,Valid
Shanghai,PM2.5,1/10/14 08:00,2014,1,10,8,38,µg/m_,1 Hr,Valid
Shanghai,PM2.5,1/10/14 09:00,2014,1,10,9,40,µg/m_,1 Hr,Valid
Shanghai,PM2.5,1/10/14 10:00,2014,1,10,10,43,µg/m_,1 Hr,Valid
Shanghai,PM2.5,1/10/14 11:00,2014,1,10,11,50,µg/m_,1 Hr,Valid
Shanghai,PM2.5,1/10/14 12:00,2014,1,10,12,47,µg/m_,1 Hr,Valid
Shanghai,PM2.5,1/10/14 13:00,2014,1,10,13,53,µg/m_,1 Hr,Valid
Shanghai,PM2.5,1/10/14 14:00,2014,1,10,14,55,µg/m_,1 Hr,Valid
Shanghai,PM2.5,1/10/14 15:00,2014,1,10,15,54,µg/m_,1 Hr,Valid
Shanghai,PM2.5,1/10/14 16:00,2014,1,10,16,55,µg/m_,1 Hr,Valid
Shanghai,PM2.5,1/10/14 17:00,2014,1,10,17,61,µg/m_,1 Hr,Valid
Shanghai,PM2.5,1/10/14 18:00,2014,1,10,18,60,µg/m_,1 Hr,Valid
Shanghai,PM2.5,1/10/14 19:00,2014,1,10,19,58,µg/m_,1 Hr,Valid
Shanghai,PM2.5,1/10/14 20:00,2014,1,10,20,66,µg/m_,1 Hr,Valid
Shanghai,PM2.5,1/10/14 21:00,2014,1,10,21,59,µg/m_,1 Hr,Valid
Shanghai,PM2.5,1/10/14 22:00,2014,1,10,22,63,µg/m_,1 Hr,Valid
Shanghai,PM2.5,1/10/14 23:00,2014,1,10,23,60,µg/m_,1 Hr,Valid
Shanghai,PM2.5,1/11/14 00:00,2014,1,11,0,57,µg/m_,1 Hr,Valid
Shanghai,PM2.5,1/11/14 01:00,2014,1,11,1,52,µg/m_,1 Hr,Valid
Shanghai,PM2.5,1/11/14 02:00,2014,1,11,2,43,µg/m_,1 Hr,Valid
Shanghai,PM2.5,1/11/14 03:00,2014,1,11,3,40,µg/m_,1 Hr,Valid
Shanghai,PM2.5,1/11/14 04:00,2014,1,11,4,38,µg/m_,1 Hr,Valid
Shanghai,PM2.5,1/11/14 05:00,2014,1,11,5,42,µg/m_,1 Hr,Valid
Shanghai,PM2.5,1/11/14 06:00,2014,1,11,6,41,µg/m_,1 Hr,Valid
Shanghai,PM2.5,1/11/14 07:00,2014,1,11,7,49,µg/m_,1 Hr,Valid
Shanghai,PM2.5,1/11/14 08:00,2014,1,11,8,41,µg/m_,1 Hr,Valid
Shanghai,PM2.5,1/11/14 09:00,2014,1,11,9,49,µg/m_,1 Hr,Valid
Shanghai,PM2.5,1/11/14 10:00,2014,1,11,10,43,µg/m_,1 Hr,Valid
Shanghai,PM2.5,1/11/14 11:00,2014,1,11,11,50,µg/m_,1 Hr,Valid
Shanghai,PM2.5,1/11/14 12:00,2014,1,11,12,40,µg/m_,1 Hr,Valid
Shanghai,PM2.5,1/11/14 13:00,2014,1,11,13,41,µg/m_,1 Hr,Valid
Shanghai,PM2.5,1/11/14 14:00,2014,1,11,14,47,µg/m_,1 Hr,Valid
Shanghai,PM2.5,1/11/14 15:00,2014,1,11,15,48,µg/m_,1 Hr,Valid
Shanghai,PM2.5,1/11/14 16:00,2014,1,11,16,49,µg/m_,1 Hr,Valid
Shanghai,PM2.5,1/11/14 17:00,2014,1,11,17,55,µg/m_,1 Hr,Valid
Shanghai,PM2.5,1/11/14 18:00,2014,1,11,18,47,µg/m_,1 Hr,Valid
Shanghai,PM2.5,1/11/14 19:00,2014,1,11,19,50,µg/m_,1 Hr,Valid
Shanghai,PM2.5,1/11/14 20:00,2014,1,11,20,43,µg/m_,1 Hr,Valid
Shanghai,PM2.5,1/11/14 21:00,2014,1,11,21,44,µg/m_,1 Hr,Valid
Shanghai,PM2.5,1/11/14 22:00,2014,1,11,22,44,µg/m_,1 Hr,Valid
Shanghai,PM2.5,1/11/14 23:00,2014,1,11,23,38,µg/m_,1 Hr,Valid
Shanghai,PM2.5,1/12/14 00:00,2014,1,12,0,45,µg/m_,1 Hr,Valid
Shanghai,PM2.5,1/12/14 01:00,2014,1,12,1,44,µg/m_,1 Hr,Valid
Shanghai,PM2.5,1/12/14 02:00,2014,1,12,2,43,µg/m_,1 Hr,Valid
Shanghai,PM2.5,1/12/14 03:00,2014,1,12,3,35,µg/m_,1 Hr,Valid
Shanghai,PM2.5,1/12/14 04:00,2014,1,12,4,37,µg/m_,1 Hr,Valid
Shanghai,PM2.5,1/12/14 05:00,2014,1,12,5,48,µg/m_,1 Hr,Valid
Shanghai,PM2.5,1/12/14 06:00,2014,1,12,6,47,µg/m_,1 Hr,Valid
Shanghai,PM2.5,1/12/14 07:00,2014,1,12,7,45,µg/m_,1 Hr,Valid
Shanghai,PM2.5,1/12/14 08:00,2014,1,12,8,37,µg/m_,1 Hr,Valid
Shanghai,PM2.5,1/12/14 09:00,2014,1,12,9,55,µg/m_,1 Hr,Valid
Shanghai,PM2.5,1/12/14 10:00,2014,1,12,10,58,µg/m_,1 Hr,Valid
Shanghai,PM2.5,1/12/14 11:00,2014,1,12,11,62,µg/m_,1 Hr,Valid
Shanghai,PM2.5,1/12/14 12:00,2014,1,12,12,62,µg/m_,1 Hr,Valid
Shanghai,PM2.5,1/12/14 13:00,2014,1,12,13,76,µg/m_,1 Hr,Valid
Shanghai,PM2.5,1/12/14 14:00,2014,1,12,14,80,µg/m_,1 Hr,Valid
Shanghai,PM2.5,1/12/14 15:00,2014,1,12,15,97,µg/m_,1 Hr,Valid
Shanghai,PM2.5,1/12/14 16:00,2014,1,12,16,113,µg/m_,1 Hr,Valid
Shanghai,PM2.5,1/12/14 17:00,2014,1,12,17,104,µg/m_,1 Hr,Valid
Shanghai,PM2.5,1/12/14 18:00,2014,1,12,18,122,µg/m_,1 Hr,Valid
Shanghai,PM2.5,1/12/14 19:00,2014,1,12,19,157,µg/m_,1 Hr,Valid
Shanghai,PM2.5,1/12/14 20:00,2014,1,12,20,145,µg/m_,1 Hr,Valid
Shanghai,PM2.5,1/12/14 21:00,2014,1,12,21,166,µg/m_,1 Hr,Valid
Shanghai,PM2.5,1/12/14 22:00,2014,1,12,22,178,µg/m_,1 Hr,Valid
Shanghai,PM2.5,1/12/14 23:00,2014,1,12,23,194,µg/m_,1 Hr,Valid
Shanghai,PM2.5,1/13/14 00:00,2014,1,13,0,188,µg/m_,1 Hr,Valid
Shanghai,PM2.5,1/13/14 01:00,2014,1,13,1,118,µg/m_,1 Hr,Valid
Shanghai,PM2.5,1/13/14 02:00,2014,1,13,2,73,µg/m_,1 Hr,Valid
Shanghai,PM2.5,1/13/14 03:00,2014,1,13,3,45,µg/m_,1 Hr,Valid
Shanghai,PM2.5,1/13/14 04:00,2014,1,13,4,32,µg/m_,1 Hr,Valid
Shanghai,PM2.5,1/13/14 05:00,2014,1,13,5,27,µg/m_,1 Hr,Valid
Shanghai,PM2.5,1/13/14 06:00,2014,1,13,6,25,µg/m_,1 Hr,Valid
Shanghai,PM2.5,1/13/14 07:00,2014,1,13,7,28,µg/m_,1 Hr,Valid
Shanghai,PM2.5,1/13/14 08:00,2014,1,13,8,27,µg/m_,1 Hr,Valid
Shanghai,PM2.5,1/13/14 09:00,2014,1,13,9,30,µg/m_,1 Hr,Valid
Shanghai,PM2.5,1/13/14 10:00,2014,1,13,10,35,µg/m_,1 Hr,Valid
Shanghai,PM2.5,1/13/14 11:00,2014,1,13,11,33,µg/m_,1 Hr,Valid
Shanghai,PM2.5,1/13/14 12:00,2014,1,13,12,27,µg/m_,1 Hr,Valid
Shanghai,PM2.5,1/13/14 13:00,2014,1,13,13,30,µg/m_,1 Hr,Valid
Shanghai,PM2.5,1/13/14 14:00,2014,1,13,14,27,µg/m_,1 Hr,Valid
Shanghai,PM2.5,1/13/14 15:00,2014,1,13,15,31,µg/m_,1 Hr,Valid
Shanghai,PM2.5,1/13/14 16:00,2014,1,13,16,28,µg/m_,1 Hr,Valid
Shanghai,PM2.5,1/13/14 17:00,2014,1,13,17,24,µg/m_,1 Hr,Valid
Shanghai,PM2.5,1/13/14 18:00,2014,1,13,18,25,µg/m_,1 Hr,Valid
Shanghai,PM2.5,1/13/14 19:00,2014,1,13,19,20,µg/m_,1 Hr,Valid
Shanghai,PM2.5,1/13/14 20:00,2014,1,13,20,17,µg/m_,1 Hr,Valid
Shanghai,PM2.5,1/13/14 21:00,2014,1,13,21,20,µg/m_,1 Hr,Valid
Shanghai,PM2.5,1/13/14 22:00,2014,1,13,22,19,µg/m_,1 Hr,Valid
Shanghai,PM2.5,1/13/14 23:00,2014,1,13,23,17,µg/m_,1 Hr,Valid
Shanghai,PM2.5,1/14/14 00:00,2014,1,14,0,18,µg/m_,1 Hr,Valid
Shanghai,PM2.5,1/14/14 01:00,2014,1,14,1,18,µg/m_,1 Hr,Valid
Shanghai,PM2.5,1/14/14 02:00,2014,1,14,2,17,µg/m_,1 Hr,Valid
Shanghai,PM2.5,1/14/14 03:00,2014,1,14,3,22,µg/m_,1 Hr,Valid
Shanghai,PM2.5,1/14/14 04:00,2014,1,14,4,22,µg/m_,1 Hr,Valid
Shanghai,PM2.5,1/14/14 05:00,2014,1,14,5,20,µg/m_,1 Hr,Valid
Shanghai,PM2.5,1/14/14 06:00,2014,1,14,6,23,µg/m_,1 Hr,Valid
Shanghai,PM2.5,1/14/14 07:00,2014,1,14,7,35,µg/m_,1 Hr,Valid
Shanghai,PM2.5,1/14/14 08:00,2014,1,14,8,25,µg/m_,1 Hr,Valid
Shanghai,PM2.5,1/14/14 09:00,2014,1,14,9,21,µg/m_,1 Hr,Valid
Shanghai,PM2.5,1/14/14 10:00,2014,1,14,10,21,µg/m_,1 Hr,Valid
Shanghai,PM2.5,1/14/14 11:00,2014,1,14,11,20,µg/m_,1 Hr,Valid
Shanghai,PM2.5,1/14/14 12:00,2014,1,14,12,20,µg/m_,1 Hr,Valid
Shanghai,PM2.5,1/14/14 13:00,2014,1,14,13,23,µg/m_,1 Hr,Valid
Shanghai,PM2.5,1/14/14 14:00,2014,1,14,14,27,µg/m_,1 Hr,Valid
Shanghai,PM2.5,1/14/14 15:00,2014,1,14,15,29,µg/m_,1 Hr,Valid
Shanghai,PM2.5,1/14/14 16:00,2014,1,14,16,26,µg/m_,1 Hr,Valid
Shanghai,PM2.5,1/14/14 17:00,2014,1,14,17,27,µg/m_,1 Hr,Valid
Shanghai,PM2.5,1/14/14 18:00,2014,1,14,18,30,µg/m_,1 Hr,Valid
Shanghai,PM2.5,1/14/14 19:00,2014,1,14,19,32,µg/m_,1 Hr,Valid
Shanghai,PM2.5,1/14/14 20:00,2014,1,14,20,29,µg/m_,1 Hr,Valid
Shanghai,PM2.5,1/14/14 21:00,2014,1,14,21,28,µg/m_,1 Hr,Valid
Shanghai,PM2.5,1/14/14 22:00,2014,1,14,22,27,µg/m_,1 Hr,Valid
Shanghai,PM2.5,1/14/14 23:00,2014,1,14,23,28,µg/m_,1 Hr,Valid
Shanghai,PM2.5,1/15/14 00:00,2014,1,15,0,28,µg/m_,1 Hr,Valid
Shanghai,PM2.5,1/15/14 01:00,2014,1,15,1,24,µg/m_,1 Hr,Valid
Shanghai,PM2.5,1/15/14 02:00,2014,1,15,2,23,µg/m_,1 Hr,Valid
Shanghai,PM2.5,1/15/14 03:00,2014,1,15,3,28,µg/m_,1 Hr,Valid
Shanghai,PM2.5,1/15/14 04:00,2014,1,15,4,25,µg/m_,1 Hr,Valid
Shanghai,PM2.5,1/15/14 05:00,2014,1,15,5,24,µg/m_,1 Hr,Valid
Shanghai,PM2.5,1/15/14 06:00,2014,1,15,6,23,µg/m_,1 Hr,Valid
Shanghai,PM2.5,1/15/14 07:00,2014,1,15,7,25,µg/m_,1 Hr,Valid
Shanghai,PM2.5,1/15/14 08:00,2014,1,15,8,26,µg/m_,1 Hr,Valid
Shanghai,PM2.5,1/15/14 09:00,2014,1,15,9,25,µg/m_,1 Hr,Valid
Shanghai,PM2.5,1/15/14 10:00,2014,1,15,10,23,µg/m_,1 Hr,Valid
Shanghai,PM2.5,1/15/14 11:00,2014,1,15,11,28,µg/m_,1 Hr,Valid
Shanghai,PM2.5,1/15/14 12:00,2014,1,15,12,30,µg/m_,1 Hr,Valid
Shanghai,PM2.5,1/15/14 13:00,2014,1,15,13,36,µg/m_,1 Hr,Valid
Shanghai,PM2.5,1/15/14 14:00,2014,1,15,14,30,µg/m_,1 Hr,Valid
Shanghai,PM2.5,1/15/14 15:00,2014,1,15,15,30,µg/m_,1 Hr,Valid
Shanghai,PM2.5,1/15/14 16:00,2014,1,15,16,35,µg/m_,1 Hr,Valid
Shanghai,PM2.5,1/15/14 17:00,2014,1,15,17,27,µg/m_,1 Hr,Valid
Shanghai,PM2.5,1/15/14 18:00,2014,1,15,18,31,µg/m_,1 Hr,Valid
Shanghai,PM2.5,1/15/14 19:00,2014,1,15,19,49,µg/m_,1 Hr,Valid
Shanghai,PM2.5,1/15/14 20:00,2014,1,15,20,52,µg/m_,1 Hr,Valid
Shanghai,PM2.5,1/15/14 21:00,2014,1,15,21,61,µg/m_,1 Hr,Valid
Shanghai,PM2.5,1/15/14 22:00,2014,1,15,22,70,µg/m_,1 Hr,Valid
Shanghai,PM2.5,1/15/14 23:00,2014,1,15,23,73,µg/m_,1 Hr,Valid
Shanghai,PM2.5,1/16/14 00:00,2014,1,16,0,74,µg/m_,1 Hr,Valid
Shanghai,PM2.5,1/16/14 01:00,2014,1,16,1,79,µg/m_,1 Hr,Valid
Shanghai,PM2.5,1/16/14 02:00,2014,1,16,2,77,µg/m_,1 Hr,Valid
Shanghai,PM2.5,1/16/14 03:00,2014,1,16,3,85,µg/m_,1 Hr,Valid
Shanghai,PM2.5,1/16/14 04:00,2014,1,16,4,85,µg/m_,1 Hr,Valid
Shanghai,PM2.5,1/16/14 05:00,2014,1,16,5,84,µg/m_,1 Hr,Valid
Shanghai,PM2.5,1/16/14 06:00,2014,1,16,6,89,µg/m_,1 Hr,Valid
Shanghai,PM2.5,1/16/14 07:00,2014,1,16,7,97,µg/m_,1 Hr,Valid
Shanghai,PM2.5,1/16/14 08:00,2014,1,16,8,94,µg/m_,1 Hr,Valid
Shanghai,PM2.5,1/16/14 09:00,2014,1,16,9,73,µg/m_,1 Hr,Valid
Shanghai,PM2.5,1/16/14 10:00,2014,1,16,10,70,µg/m_,1 Hr,Valid
Shanghai,PM2.5,1/16/14 11:00,2014,1,16,11,58,µg/m_,1 Hr,Valid
Shanghai,PM2.5,1/16/14 12:00,2014,1,16,12,62,µg/m_,1 Hr,Valid
Shanghai,PM2.5,1/16/14 13:00,2014,1,16,13,53,µg/m_,1 Hr,Valid
Shanghai,PM2.5,1/16/14 14:00,2014,1,16,14,47,µg/m_,1 Hr,Valid
Shanghai,PM2.5,1/16/14 15:00,2014,1,16,15,61,µg/m_,1 Hr,Valid
Shanghai,PM2.5,1/16/14 16:00,2014,1,16,16,52,µg/m_,1 Hr,Valid
Shanghai,PM2.5,1/16/14 17:00,2014,1,16,17,57,µg/m_,1 Hr,Valid
Shanghai,PM2.5,1/16/14 18:00,2014,1,16,18,69,µg/m_,1 Hr,Valid
Shanghai,PM2.5,1/16/14 19:00,2014,1,16,19,62,µg/m_,1 Hr,Valid
Shanghai,PM2.5,1/16/14 20:00,2014,1,16,20,60,µg/m_,1 Hr,Valid
Shanghai,PM2.5,1/16/14 21:00,2014,1,16,21,58,µg/m_,1 Hr,Valid
Shanghai,PM2.5,1/16/14 22:00,2014,1,16,22,61,µg/m_,1 Hr,Valid
Shanghai,PM2.5,1/16/14 23:00,2014,1,16,23,63,µg/m_,1 Hr,Valid
Shanghai,PM2.5,1/17/14 00:00,2014,1,17,0,68,µg/m_,1 Hr,Valid
Shanghai,PM2.5,1/17/14 01:00,2014,1,17,1,65,µg/m_,1 Hr,Valid
Shanghai,PM2.5,1/17/14 02:00,2014,1,17,2,63,µg/m_,1 Hr,Valid
Shanghai,PM2.5,1/17/14 03:00,2014,1,17,3,63,µg/m_,1 Hr,Valid
Shanghai,PM2.5,1/17/14 04:00,2014,1,17,4,62,µg/m_,1 Hr,Valid
Shanghai,PM2.5,1/17/14 05:00,2014,1,17,5,59,µg/m_,1 Hr,Valid
Shanghai,PM2.5,1/17/14 06:00,2014,1,17,6,69,µg/m_,1 Hr,Valid
Shanghai,PM2.5,1/17/14 07:00,2014,1,17,7,69,µg/m_,1 Hr,Valid
Shanghai,PM2.5,1/17/14 08:00,2014,1,17,8,71,µg/m_,1 Hr,Valid
Shanghai,PM2.5,1/17/14 09:00,2014,1,17,9,69,µg/m_,1 Hr,Valid
Shanghai,PM2.5,1/17/14 10:00,2014,1,17,10,61,µg/m_,1 Hr,Valid
Shanghai,PM2.5,1/17/14 11:00,2014,1,17,11,66,µg/m_,1 Hr,Valid
Shanghai,PM2.5,1/17/14 12:00,2014,1,17,12,80,µg/m_,1 Hr,Valid
Shanghai,PM2.5,1/17/14 13:00,2014,1,17,13,75,µg/m_,1 Hr,Valid
Shanghai,PM2.5,1/17/14 14:00,2014,1,17,14,84,µg/m_,1 Hr,Valid
Shanghai,PM2.5,1/17/14 15:00,2014,1,17,15,93,µg/m_,1 Hr,Valid
Shanghai,PM2.5,1/17/14 16:00,2014,1,17,16,120,µg/m_,1 Hr,Valid
Shanghai,PM2.5,1/17/14 17:00,2014,1,17,17,111,µg/m_,1 Hr,Valid
Shanghai,PM2.5,1/17/14 18:00,2014,1,17,18,121,µg/m_,1 Hr,Valid
Shanghai,PM2.5,1/17/14 19:00,2014,1,17,19,129,µg/m_,1 Hr,Valid
Shanghai,PM2.5,1/17/14 20:00,2014,1,17,20,141,µg/m_,1 Hr,Valid
Shanghai,PM2.5,1/17/14 21:00,2014,1,17,21,189,µg/m_,1 Hr,Valid
Shanghai,PM2.5,1/17/14 22:00,2014,1,17,22,175,µg/m_,1 Hr,Valid
Shanghai,PM2.5,1/17/14 23:00,2014,1,17,23,155,µg/m_,1 Hr,Valid
Shanghai,PM2.5,1/18/14 00:00,2014,1,18,0,141,µg/m_,1 Hr,Valid
Shanghai,PM2.5,1/18/14 01:00,2014,1,18,1,130,µg/m_,1 Hr,Valid
Shanghai,PM2.5,1/18/14 02:00,2014,1,18,2,89,µg/m_,1 Hr,Valid
Shanghai,PM2.5,1/18/14 03:00,2014,1,18,3,76,µg/m_,1 Hr,Valid
Shanghai,PM2.5,1/18/14 04:00,2014,1,18,4,82,µg/m_,1 Hr,Valid
Shanghai,PM2.5,1/18/14 05:00,2014,1,18,5,109,µg/m_,1 Hr,Valid
Shanghai,PM2.5,1/18/14 06:00,2014,1,18,6,140,µg/m_,1 Hr,Valid
Shanghai,PM2.5,1/18/14 07:00,2014,1,18,7,173,µg/m_,1 Hr,Valid
Shanghai,PM2.5,1/18/14 08:00,2014,1,18,8,175,µg/m_,1 Hr,Valid
Shanghai,PM2.5,1/18/14 09:00,2014,1,18,9,177,µg/m_,1 Hr,Valid
Shanghai,PM2.5,1/18/14 10:00,2014,1,18,10,192,µg/m_,1 Hr,Valid
Shanghai,PM2.5,1/18/14 11:00,2014,1,18,11,190,µg/m_,1 Hr,Valid
Shanghai,PM2.5,1/18/14 12:00,2014,1,18,12,195,µg/m_,1 Hr,Valid
Shanghai,PM2.5,1/18/14 13:00,2014,1,18,13,192,µg/m_,1 Hr,Valid
Shanghai,PM2.5,1/18/14 14:00,2014,1,18,14,203,µg/m_,1 Hr,Valid
Shanghai,PM2.5,1/18/14 15:00,2014,1,18,15,179,µg/m_,1 Hr,Valid
Shanghai,PM2.5,1/18/14 16:00,2014,1,18,16,157,µg/m_,1 Hr,Valid
Shanghai,PM2.5,1/18/14 17:00,2014,1,18,17,144,µg/m_,1 Hr,Valid
Shanghai,PM2.5,1/18/14 18:00,2014,1,18,18,144,µg/m_,1 Hr,Valid
Shanghai,PM2.5,1/18/14 19:00,2014,1,18,19,143,µg/m_,1 Hr,Valid
Shanghai,PM2.5,1/18/14 20:00,2014,1,18,20,159,µg/m_,1 Hr,Valid
Shanghai,PM2.5,1/18/14 21:00,2014,1,18,21,156,µg/m_,1 Hr,Valid
Shanghai,PM2.5,1/18/14 22:00,2014,1,18,22,136,µg/m_,1 Hr,Valid
Shanghai,PM2.5,1/18/14 23:00,2014,1,18,23,144,µg/m_,1 Hr,Valid
Shanghai,PM2.5,1/19/14 00:00,2014,1,19,0,133,µg/m_,1 Hr,Valid
Shanghai,PM2.5,1/19/14 01:00,2014,1,19,1,108,µg/m_,1 Hr,Valid
Shanghai,PM2.5,1/19/14 02:00,2014,1,19,2,115,µg/m_,1 Hr,Valid
Shanghai,PM2.5,1/19/14 03:00,2014,1,19,3,92,µg/m_,1 Hr,Valid
Shanghai,PM2.5,1/19/14 04:00,2014,1,19,4,104,µg/m_,1 Hr,Valid
Shanghai,PM2.5,1/19/14 05:00,2014,1,19,5,110,µg/m_,1 Hr,Valid
Shanghai,PM2.5,1/19/14 06:00,2014,1,19,6,115,µg/m_,1 Hr,Valid
Shanghai,PM2.5,1/19/14 07:00,2014,1,19,7,124,µg/m_,1 Hr,Valid
Shanghai,PM2.5,1/19/14 08:00,2014,1,19,8,112,µg/m_,1 Hr,Valid
Shanghai,PM2.5,1/19/14 09:00,2014,1,19,9,92,µg/m_,1 Hr,Valid
Shanghai,PM2.5,1/19/14 10:00,2014,1,19,10,96,µg/m_,1 Hr,Valid
Shanghai,PM2.5,1/19/14 11:00,2014,1,19,11,82,µg/m_,1 Hr,Valid
Shanghai,PM2.5,1/19/14 12:00,2014,1,19,12,94,µg/m_,1 Hr,Valid
Shanghai,PM2.5,1/19/14 13:00,2014,1,19,13,85,µg/m_,1 Hr,Valid
Shanghai,PM2.5,1/19/14 14:00,2014,1,19,14,71,µg/m_,1 Hr,Valid
Shanghai,PM2.5,1/19/14 15:00,2014,1,19,15,69,µg/m_,1 Hr,Valid
Shanghai,PM2.5,1/19/14 16:00,2014,1,19,16,94,µg/m_,1 Hr,Valid
Shanghai,PM2.5,1/19/14 17:00,2014,1,19,17,122,µg/m_,1 Hr,Valid
Shanghai,PM2.5,1/19/14 18:00,2014,1,19,18,147,µg/m_,1 Hr,Valid
Shanghai,PM2.5,1/19/14 19:00,2014,1,19,19,143,µg/m_,1 Hr,Valid
Shanghai,PM2.5,1/19/14 20:00,2014,1,19,20,145,µg/m_,1 Hr,Valid
Shanghai,PM2.5,1/19/14 21:00,2014,1,19,21,121,µg/m_,1 Hr,Valid
Shanghai,PM2.5,1/19/14 22:00,2014,1,19,22,116,µg/m_,1 Hr,Valid
Shanghai,PM2.5,1/19/14 23:00,2014,1,19,23,105,µg/m_,1 Hr,Valid
Shanghai,PM2.5,1/20/14 00:00,2014,1,20,0,113,µg/m_,1 Hr,Valid
Shanghai,PM2.5,1/20/14 01:00,2014,1,20,1,135,µg/m_,1 Hr,Valid
Shanghai,PM2.5,1/20/14 02:00,2014,1,20,2,173,µg/m_,1 Hr,Valid
Shanghai,PM2.5,1/20/14 03:00,2014,1,20,3,196,µg/m_,1 Hr,Valid
Shanghai,PM2.5,1/20/14 04:00,2014,1,20,4,196,µg/m_,1 Hr,Valid
Shanghai,PM2.5,1/20/14 05:00,2014,1,20,5,198,µg/m_,1 Hr,Valid
Shanghai,PM2.5,1/20/14 06:00,2014,1,20,6,199,µg/m_,1 Hr,Valid
Shanghai,PM2.5,1/20/14 07:00,2014,1,20,7,214,µg/m_,1 Hr,Valid
Shanghai,PM2.5,1/20/14 08:00,2014,1,20,8,228,µg/m_,1 Hr,Valid
Shanghai,PM2.5,1/20/14 09:00,2014,1,20,9,247,µg/m_,1 Hr,Valid
Shanghai,PM2.5,1/20/14 10:00,2014,1,20,10,239,µg/m_,1 Hr,Valid
Shanghai,PM2.5,1/20/14 11:00,2014,1,20,11,227,µg/m_,1 Hr,Valid
Shanghai,PM2.5,1/20/14 12:00,2014,1,20,12,227,µg/m_,1 Hr,Valid
Shanghai,PM2.5,1/20/14 13:00,2014,1,20,13,218,µg/m_,1 Hr,Valid
Shanghai,PM2.5,1/20/14 14:00,2014,1,20,14,178,µg/m_,1 Hr,Valid
Shanghai,PM2.5,1/20/14 15:00,2014,1,20,15,155,µg/m_,1 Hr,Valid
Shanghai,PM2.5,1/20/14 16:00,2014,1,20,16,141,µg/m_,1 Hr,Valid
Shanghai,PM2.5,1/20/14 17:00,2014,1,20,17,180,µg/m_,1 Hr,Valid
Shanghai,PM2.5,1/20/14 18:00,2014,1,20,18,162,µg/m_,1 Hr,Valid
Shanghai,PM2.5,1/20/14 19:00,2014,1,20,19,102,µg/m_,1 Hr,Valid
Shanghai,PM2.5,1/20/14 20:00,2014,1,20,20,96,µg/m_,1 Hr,Valid
Shanghai,PM2.5,1/20/14 21:00,2014,1,20,21,67,µg/m_,1 Hr,Valid
Shanghai,PM2.5,1/20/14 22:00,2014,1,20,22,59,µg/m_,1 Hr,Valid
Shanghai,PM2.5,1/20/14 23:00,2014,1,20,23,51,µg/m_,1 Hr,Valid
Shanghai,PM2.5,1/21/14 00:00,2014,1,21,0,61,µg/m_,1 Hr,Valid
Shanghai,PM2.5,1/21/14 01:00,2014,1,21,1,66,µg/m_,1 Hr,Valid
Shanghai,PM2.5,1/21/14 02:00,2014,1,21,2,68,µg/m_,1 Hr,Valid
Shanghai,PM2.5,1/21/14 03:00,2014,1,21,3,61,µg/m_,1 Hr,Valid
Shanghai,PM2.5,1/21/14 04:00,2014,1,21,4,74,µg/m_,1 Hr,Valid
Shanghai,PM2.5,1/21/14 05:00,2014,1,21,5,66,µg/m_,1 Hr,Valid
Shanghai,PM2.5,1/21/14 06:00,2014,1,21,6,50,µg/m_,1 Hr,Valid
Shanghai,PM2.5,1/21/14 07:00,2014,1,21,7,38,µg/m_,1 Hr,Valid
Shanghai,PM2.5,1/21/14 08:00,2014,1,21,8,39,µg/m_,1 Hr,Valid
Shanghai,PM2.5,1/21/14 09:00,2014,1,21,9,41,µg/m_,1 Hr,Valid
Shanghai,PM2.5,1/21/14 10:00,2014,1,21,10,27,µg/m_,1 Hr,Valid
Shanghai,PM2.5,1/21/14 11:00,2014,1,21,11,26,µg/m_,1 Hr,Valid
Shanghai,PM2.5,1/21/14 12:00,2014,1,21,12,23,µg/m_,1 Hr,Valid
Shanghai,PM2.5,1/21/14 13:00,2014,1,21,13,27,µg/m_,1 Hr,Valid
Shanghai,PM2.5,1/21/14 14:00,2014,1,21,14,32,µg/m_,1 Hr,Valid
Shanghai,PM2.5,1/21/14 15:00,2014,1,21,15,34,µg/m_,1 Hr,Valid
Shanghai,PM2.5,1/21/14 16:00,2014,1,21,16,40,µg/m_,1 Hr,Valid
Shanghai,PM2.5,1/21/14 17:00,2014,1,21,17,48,µg/m_,1 Hr,Valid
Shanghai,PM2.5,1/21/14 18:00,2014,1,21,18,48,µg/m_,1 Hr,Valid
Shanghai,PM2.5,1/21/14 19:00,2014,1,21,19,48,µg/m_,1 Hr,Valid
Shanghai,PM2.5,1/21/14 20:00,2014,1,21,20,51,µg/m_,1 Hr,Valid
Shanghai,PM2.5,1/21/14 21:00,2014,1,21,21,49,µg/m_,1 Hr,Valid
Shanghai,PM2.5,1/21/14 22:00,2014,1,21,22,42,µg/m_,1 Hr,Valid
Shanghai,PM2.5,1/21/14 23:00,2014,1,21,23,38,µg/m_,1 Hr,Valid
Shanghai,PM2.5,1/22/14 00:00,2014,1,22,0,37,µg/m_,1 Hr,Valid
Shanghai,PM2.5,1/22/14 01:00,2014,1,22,1,36,µg/m_,1 Hr,Valid
Shanghai,PM2.5,1/22/14 02:00,2014,1,22,2,39,µg/m_,1 Hr,Valid
Shanghai,PM2.5,1/22/14 03:00,2014,1,22,3,36,µg/m_,1 Hr,Valid
Shanghai,PM2.5,1/22/14 04:00,2014,1,22,4,38,µg/m_,1 Hr,Valid
Shanghai,PM2.5,1/22/14 05:00,2014,1,22,5,38,µg/m_,1 Hr,Valid
Shanghai,PM2.5,1/22/14 06:00,2014,1,22,6,39,µg/m_,1 Hr,Valid
Shanghai,PM2.5,1/22/14 07:00,2014,1,22,7,40,µg/m_,1 Hr,Valid
Shanghai,PM2.5,1/22/14 08:00,2014,1,22,8,55,µg/m_,1 Hr,Valid
Shanghai,PM2.5,1/22/14 09:00,2014,1,22,9,61,µg/m_,1 Hr,Valid
Shanghai,PM2.5,1/22/14 10:00,2014,1,22,10,63,µg/m_,1 Hr,Valid
Shanghai,PM2.5,1/22/14 11:00,2014,1,22,11,54,µg/m_,1 Hr,Valid
Shanghai,PM2.5,1/22/14 12:00,2014,1,22,12,66,µg/m_,1 Hr,Valid
Shanghai,PM2.5,1/22/14 13:00,2014,1,22,13,76,µg/m_,1 Hr,Valid
Shanghai,PM2.5,1/22/14 14:00,2014,1,22,14,70,µg/m_,1 Hr,Valid
Shanghai,PM2.5,1/22/14 15:00,2014,1,22,15,72,µg/m_,1 Hr,Valid
Shanghai,PM2.5,1/22/14 16:00,2014,1,22,16,75,µg/m_,1 Hr,Valid
Shanghai,PM2.5,1/22/14 17:00,2014,1,22,17,62,µg/m_,1 Hr,Valid
Shanghai,PM2.5,1/22/14 18:00,2014,1,22,18,57,µg/m_,1 Hr,Valid
Shanghai,PM2.5,1/22/14 19:00,2014,1,22,19,55,µg/m_,1 Hr,Valid
Shanghai,PM2.5,1/22/14 20:00,2014,1,22,20,51,µg/m_,1 Hr,Valid
Shanghai,PM2.5,1/22/14 21:00,2014,1,22,21,41,µg/m_,1 Hr,Valid
Shanghai,PM2.5,1/22/14 22:00,2014,1,22,22,43,µg/m_,1 Hr,Valid
Shanghai,PM2.5,1/22/14 23:00,2014,1,22,23,37,µg/m_,1 Hr,Valid
Shanghai,PM2.5,1/23/14 00:00,2014,1,23,0,33,µg/m_,1 Hr,Valid
Shanghai,PM2.5,1/23/14 01:00,2014,1,23,1,34,µg/m_,1 Hr,Valid
Shanghai,PM2.5,1/23/14 02:00,2014,1,23,2,38,µg/m_,1 Hr,Valid
Shanghai,PM2.5,1/23/14 03:00,2014,1,23,3,28,µg/m_,1 Hr,Valid
Shanghai,PM2.5,1/23/14 04:00,2014,1,23,4,28,µg/m_,1 Hr,Valid
Shanghai,PM2.5,1/23/14 05:00,2014,1,23,5,35,µg/m_,1 Hr,Valid
Shanghai,PM2.5,1/23/14 06:00,2014,1,23,6,48,µg/m_,1 Hr,Valid
Shanghai,PM2.5,1/23/14 07:00,2014,1,23,7,58,µg/m_,1 Hr,Valid
Shanghai,PM2.5,1/23/14 08:00,2014,1,23,8,54,µg/m_,1 Hr,Valid
Shanghai,PM2.5,1/23/14 09:00,2014,1,23,9,56,µg/m_,1 Hr,Valid
Shanghai,PM2.5,1/23/14 10:00,2014,1,23,10,-999,µg/m_,1 Hr,Missing
Shanghai,PM2.5,1/23/14 11:00,2014,1,23,11,48,µg/m_,1 Hr,Valid
Shanghai,PM2.5,1/23/14 12:00,2014,1,23,12,44,µg/m_,1 Hr,Valid
Shanghai,PM2.5,1/23/14 13:00,2014,1,23,13,39,µg/m_,1 Hr,Valid
Shanghai,PM2.5,1/23/14 14:00,2014,1,23,14,37,µg/m_,1 Hr,Valid
Shanghai,PM2.5,1/23/14 15:00,2014,1,23,15,35,µg/m_,1 Hr,Valid
Shanghai,PM2.5,1/23/14 16:00,2014,1,23,16,36,µg/m_,1 Hr,Valid
Shanghai,PM2.5,1/23/14 17:00,2014,1,23,17,40,µg/m_,1 Hr,Valid
Shanghai,PM2.5,1/23/14 18:00,2014,1,23,18,48,µg/m_,1 Hr,Valid
Shanghai,PM2.5,1/23/14 19:00,2014,1,23,19,39,µg/m_,1 Hr,Valid
Shanghai,PM2.5,1/23/14 20:00,2014,1,23,20,46,µg/m_,1 Hr,Valid
Shanghai,PM2.5,1/23/14 21:00,2014,1,23,21,33,µg/m_,1 Hr,Valid
Shanghai,PM2.5,1/23/14 22:00,2014,1,23,22,38,µg/m_,1 Hr,Valid
Shanghai,PM2.5,1/23/14 23:00,2014,1,23,23,27,µg/m_,1 Hr,Valid
Shanghai,PM2.5,1/24/14 00:00,2014,1,24,0,31,µg/m_,1 Hr,Valid
Shanghai,PM2.5,1/24/14 01:00,2014,1,24,1,38,µg/m_,1 Hr,Valid
Shanghai,PM2.5,1/24/14 02:00,2014,1,24,2,34,µg/m_,1 Hr,Valid
Shanghai,PM2.5,1/24/14 03:00,2014,1,24,3,39,µg/m_,1 Hr,Valid
Shanghai,PM2.5,1/24/14 04:00,2014,1,24,4,41,µg/m_,1 Hr,Valid
Shanghai,PM2.5,1/24/14 05:00,2014,1,24,5,37,µg/m_,1 Hr,Valid
Shanghai,PM2.5,1/24/14 06:00,2014,1,24,6,36,µg/m_,1 Hr,Valid
Shanghai,PM2.5,1/24/14 07:00,2014,1,24,7,32,µg/m_,1 Hr,Valid
Shanghai,PM2.5,1/24/14 08:00,2014,1,24,8,40,µg/m_,1 Hr,Valid
Shanghai,PM2.5,1/24/14 09:00,2014,1,24,9,40,µg/m_,1 Hr,Valid
Shanghai,PM2.5,1/24/14 10:00,2014,1,24,10,33,µg/m_,1 Hr,Valid
Shanghai,PM2.5,1/24/14 11:00,2014,1,24,11,36,µg/m_,1 Hr,Valid
Shanghai,PM2.5,1/24/14 12:00,2014,1,24,12,42,µg/m_,1 Hr,Valid
Shanghai,PM2.5,1/24/14 13:00,2014,1,24,13,35,µg/m_,1 Hr,Valid
Shanghai,PM2.5,1/24/14 14:00,2014,1,24,14,30,µg/m_,1 Hr,Valid
Shanghai,PM2.5,1/24/14 15:00,2014,1,24,15,27,µg/m_,1 Hr,Valid
Shanghai,PM2.5,1/24/14 16:00,2014,1,24,16,26,µg/m_,1 Hr,Valid
Shanghai,PM2.5,1/24/14 17:00,2014,1,24,17,34,µg/m_,1 Hr,Valid
Shanghai,PM2.5,1/24/14 18:00,2014,1,24,18,24,µg/m_,1 Hr,Valid
Shanghai,PM2.5,1/24/14 19:00,2014,1,24,19,34,µg/m_,1 Hr,Valid
Shanghai,PM2.5,1/24/14 20:00,2014,1,24,20,26,µg/m_,1 Hr,Valid
Shanghai,PM2.5,1/24/14 21:00,2014,1,24,21,27,µg/m_,1 Hr,Valid
Shanghai,PM2.5,1/24/14 22:00,2014,1,24,22,24,µg/m_,1 Hr,Valid
Shanghai,PM2.5,1/24/14 23:00,2014,1,24,23,22,µg/m_,1 Hr,Valid
Shanghai,PM2.5,1/25/14 00:00,2014,1,25,0,26,µg/m_,1 Hr,Valid
Shanghai,PM2.5,1/25/14 01:00,2014,1,25,1,27,µg/m_,1 Hr,Valid
Shanghai,PM2.5,1/25/14 02:00,2014,1,25,2,26,µg/m_,1 Hr,Valid
Shanghai,PM2.5,1/25/14 03:00,2014,1,25,3,24,µg/m_,1 Hr,Valid
Shanghai,PM2.5,1/25/14 04:00,2014,1,25,4,27,µg/m_,1 Hr,Valid
Shanghai,PM2.5,1/25/14 05:00,2014,1,25,5,23,µg/m_,1 Hr,Valid
Shanghai,PM2.5,1/25/14 06:00,2014,1,25,6,25,µg/m_,1 Hr,Valid
Shanghai,PM2.5,1/25/14 07:00,2014,1,25,7,31,µg/m_,1 Hr,Valid
Shanghai,PM2.5,1/25/14 08:00,2014,1,25,8,44,µg/m_,1 Hr,Valid
Shanghai,PM2.5,1/25/14 09:00,2014,1,25,9,83,µg/m_,1 Hr,Valid
Shanghai,PM2.5,1/25/14 10:00,2014,1,25,10,143,µg/m_,1 Hr,Valid
Shanghai,PM2.5,1/25/14 11:00,2014,1,25,11,173,µg/m_,1 Hr,Valid
Shanghai,PM2.5,1/25/14 12:00,2014,1,25,12,201,µg/m_,1 Hr,Valid
Shanghai,PM2.5,1/25/14 13:00,2014,1,25,13,210,µg/m_,1 Hr,Valid
Shanghai,PM2.5,1/25/14 14:00,2014,1,25,14,243,µg/m_,1 Hr,Valid
Shanghai,PM2.5,1/25/14 15:00,2014,1,25,15,209,µg/m_,1 Hr,Valid
Shanghai,PM2.5,1/25/14 16:00,2014,1,25,16,134,µg/m_,1 Hr,Valid
Shanghai,PM2.5,1/25/14 17:00,2014,1,25,17,88,µg/m_,1 Hr,Valid
Shanghai,PM2.5,1/25/14 18:00,2014,1,25,18,82,µg/m_,1 Hr,Valid
Shanghai,PM2.5,1/25/14 19:00,2014,1,25,19,86,µg/m_,1 Hr,Valid
Shanghai,PM2.5,1/25/14 20:00,2014,1,25,20,100,µg/m_,1 Hr,Valid
Shanghai,PM2.5,1/25/14 21:00,2014,1,25,21,105,µg/m_,1 Hr,Valid
Shanghai,PM2.5,1/25/14 22:00,2014,1,25,22,96,µg/m_,1 Hr,Valid
Shanghai,PM2.5,1/25/14 23:00,2014,1,25,23,88,µg/m_,1 Hr,Valid
Shanghai,PM2.5,1/26/14 00:00,2014,1,26,0,89,µg/m_,1 Hr,Valid
Shanghai,PM2.5,1/26/14 01:00,2014,1,26,1,71,µg/m_,1 Hr,Valid
Shanghai,PM2.5,1/26/14 02:00,2014,1,26,2,49,µg/m_,1 Hr,Valid
Shanghai,PM2.5,1/26/14 03:00,2014,1,26,3,27,µg/m_,1 Hr,Valid
Shanghai,PM2.5,1/26/14 04:00,2014,1,26,4,30,µg/m_,1 Hr,Valid
Shanghai,PM2.5,1/26/14 05:00,2014,1,26,5,29,µg/m_,1 Hr,Valid
Shanghai,PM2.5,1/26/14 06:00,2014,1,26,6,28,µg/m_,1 Hr,Valid
Shanghai,PM2.5,1/26/14 07:00,2014,1,26,7,22,µg/m_,1 Hr,Valid
Shanghai,PM2.5,1/26/14 08:00,2014,1,26,8,23,µg/m_,1 Hr,Valid
Shanghai,PM2.5,1/26/14 09:00,2014,1,26,9,28,µg/m_,1 Hr,Valid
Shanghai,PM2.5,1/26/14 10:00,2014,1,26,10,25,µg/m_,1 Hr,Valid
Shanghai,PM2.5,1/26/14 11:00,2014,1,26,11,23,µg/m_,1 Hr,Valid
Shanghai,PM2.5,1/26/14 12:00,2014,1,26,12,31,µg/m_,1 Hr,Valid
Shanghai,PM2.5,1/26/14 13:00,2014,1,26,13,23,µg/m_,1 Hr,Valid
Shanghai,PM2.5,1/26/14 14:00,2014,1,26,14,20,µg/m_,1 Hr,Valid
Shanghai,PM2.5,1/26/14 15:00,2014,1,26,15,22,µg/m_,1 Hr,Valid
Shanghai,PM2.5,1/26/14 16:00,2014,1,26,16,21,µg/m_,1 Hr,Valid
Shanghai,PM2.5,1/26/14 17:00,2014,1,26,17,24,µg/m_,1 Hr,Valid
Shanghai,PM2.5,1/26/14 18:00,2014,1,26,18,24,µg/m_,1 Hr,Valid
Shanghai,PM2.5,1/26/14 19:00,2014,1,26,19,23,µg/m_,1 Hr,Valid
Shanghai,PM2.5,1/26/14 20:00,2014,1,26,20,21,µg/m_,1 Hr,Valid
Shanghai,PM2.5,1/26/14 21:00,2014,1,26,21,16,µg/m_,1 Hr,Valid
Shanghai,PM2.5,1/26/14 22:00,2014,1,26,22,21,µg/m_,1 Hr,Valid
Shanghai,PM2.5,1/26/14 23:00,2014,1,26,23,17,µg/m_,1 Hr,Valid
Shanghai,PM2.5,1/27/14 00:00,2014,1,27,0,16,µg/m_,1 Hr,Valid
Shanghai,PM2.5,1/27/14 01:00,2014,1,27,1,15,µg/m_,1 Hr,Valid
Shanghai,PM2.5,1/27/14 02:00,2014,1,27,2,16,µg/m_,1 Hr,Valid
Shanghai,PM2.5,1/27/14 03:00,2014,1,27,3,17,µg/m_,1 Hr,Valid
Shanghai,PM2.5,1/27/14 04:00,2014,1,27,4,24,µg/m_,1 Hr,Valid
Shanghai,PM2.5,1/27/14 05:00,2014,1,27,5,23,µg/m_,1 Hr,Valid
Shanghai,PM2.5,1/27/14 06:00,2014,1,27,6,15,µg/m_,1 Hr,Valid
Shanghai,PM2.5,1/27/14 07:00,2014,1,27,7,20,µg/m_,1 Hr,Valid
Shanghai,PM2.5,1/27/14 08:00,2014,1,27,8,23,µg/m_,1 Hr,Valid
Shanghai,PM2.5,1/27/14 09:00,2014,1,27,9,26,µg/m_,1 Hr,Valid
Shanghai,PM2.5,1/27/14 10:00,2014,1,27,10,23,µg/m_,1 Hr,Valid
Shanghai,PM2.5,1/27/14 11:00,2014,1,27,11,21,µg/m_,1 Hr,Valid
Shanghai,PM2.5,1/27/14 12:00,2014,1,27,12,22,µg/m_,1 Hr,Valid
Shanghai,PM2.5,1/27/14 13:00,2014,1,27,13,13,µg/m_,1 Hr,Valid
Shanghai,PM2.5,1/27/14 14:00,2014,1,27,14,14,µg/m_,1 Hr,Valid
Shanghai,PM2.5,1/27/14 15:00,2014,1,27,15,21,µg/m_,1 Hr,Valid
Shanghai,PM2.5,1/27/14 16:00,2014,1,27,16,27,µg/m_,1 Hr,Valid
Shanghai,PM2.5,1/27/14 17:00,2014,1,27,17,26,µg/m_,1 Hr,Valid
Shanghai,PM2.5,1/27/14 18:00,2014,1,27,18,26,µg/m_,1 Hr,Valid
Shanghai,PM2.5,1/27/14 19:00,2014,1,27,19,27,µg/m_,1 Hr,Valid
Shanghai,PM2.5,1/27/14 20:00,2014,1,27,20,27,µg/m_,1 Hr,Valid
Shanghai,PM2.5,1/27/14 21:00,2014,1,27,21,23,µg/m_,1 Hr,Valid
Shanghai,PM2.5,1/27/14 22:00,2014,1,27,22,22,µg/m_,1 Hr,Valid
Shanghai,PM2.5,1/27/14 23:00,2014,1,27,23,22,µg/m_,1 Hr,Valid
Shanghai,PM2.5,1/28/14 00:00,2014,1,28,0,18,µg/m_,1 Hr,Valid
Shanghai,PM2.5,1/28/14 01:00,2014,1,28,1,20,µg/m_,1 Hr,Valid
Shanghai,PM2.5,1/28/14 02:00,2014,1,28,2,20,µg/m_,1 Hr,Valid
Shanghai,PM2.5,1/28/14 03:00,2014,1,28,3,24,µg/m_,1 Hr,Valid
Shanghai,PM2.5,1/28/14 04:00,2014,1,28,4,27,µg/m_,1 Hr,Valid
Shanghai,PM2.5,1/28/14 05:00,2014,1,28,5,27,µg/m_,1 Hr,Valid
Shanghai,PM2.5,1/28/14 06:00,2014,1,28,6,30,µg/m_,1 Hr,Valid
Shanghai,PM2.5,1/28/14 07:00,2014,1,28,7,38,µg/m_,1 Hr,Valid
Shanghai,PM2.5,1/28/14 08:00,2014,1,28,8,61,µg/m_,1 Hr,Valid
Shanghai,PM2.5,1/28/14 09:00,2014,1,28,9,68,µg/m_,1 Hr,Valid
Shanghai,PM2.5,1/28/14 10:00,2014,1,28,10,77,µg/m_,1 Hr,Valid
Shanghai,PM2.5,1/28/14 11:00,2014,1,28,11,84,µg/m_,1 Hr,Valid
Shanghai,PM2.5,1/28/14 12:00,2014,1,28,12,79,µg/m_,1 Hr,Valid
Shanghai,PM2.5,1/28/14 13:00,2014,1,28,13,101,µg/m_,1 Hr,Valid
Shanghai,PM2.5,1/28/14 14:00,2014,1,28,14,90,µg/m_,1 Hr,Valid
Shanghai,PM2.5,1/28/14 15:00,2014,1,28,15,67,µg/m_,1 Hr,Valid
Shanghai,PM2.5,1/28/14 16:00,2014,1,28,16,65,µg/m_,1 Hr,Valid
Shanghai,PM2.5,1/28/14 17:00,2014,1,28,17,62,µg/m_,1 Hr,Valid
Shanghai,PM2.5,1/28/14 18:00,2014,1,28,18,56,µg/m_,1 Hr,Valid
Shanghai,PM2.5,1/28/14 19:00,2014,1,28,19,56,µg/m_,1 Hr,Valid
Shanghai,PM2.5,1/28/14 20:00,2014,1,28,20,49,µg/m_,1 Hr,Valid
Shanghai,PM2.5,1/28/14 21:00,2014,1,28,21,61,µg/m_,1 Hr,Valid
Shanghai,PM2.5,1/28/14 22:00,2014,1,28,22,59,µg/m_,1 Hr,Valid
Shanghai,PM2.5,1/28/14 23:00,2014,1,28,23,56,µg/m_,1 Hr,Valid
Shanghai,PM2.5,1/29/14 00:00,2014,1,29,0,63,µg/m_,1 Hr,Valid
Shanghai,PM2.5,1/29/14 01:00,2014,1,29,1,49,µg/m_,1 Hr,Valid
Shanghai,PM2.5,1/29/14 02:00,2014,1,29,2,52,µg/m_,1 Hr,Valid
Shanghai,PM2.5,1/29/14 03:00,2014,1,29,3,44,µg/m_,1 Hr,Valid
Shanghai,PM2.5,1/29/14 04:00,2014,1,29,4,46,µg/m_,1 Hr,Valid
Shanghai,PM2.5,1/29/14 05:00,2014,1,29,5,46,µg/m_,1 Hr,Valid
Shanghai,PM2.5,1/29/14 06:00,2014,1,29,6,46,µg/m_,1 Hr,Valid
Shanghai,PM2.5,1/29/14 07:00,2014,1,29,7,55,µg/m_,1 Hr,Valid
Shanghai,PM2.5,1/29/14 08:00,2014,1,29,8,47,µg/m_,1 Hr,Valid
Shanghai,PM2.5,1/29/14 09:00,2014,1,29,9,49,µg/m_,1 Hr,Valid
Shanghai,PM2.5,1/29/14 10:00,2014,1,29,10,56,µg/m_,1 Hr,Valid
Shanghai,PM2.5,1/29/14 11:00,2014,1,29,11,46,µg/m_,1 Hr,Valid
Shanghai,PM2.5,1/29/14 12:00,2014,1,29,12,41,µg/m_,1 Hr,Valid
Shanghai,PM2.5,1/29/14 13:00,2014,1,29,13,39,µg/m_,1 Hr,Valid
Shanghai,PM2.5,1/29/14 14:00,2014,1,29,14,40,µg/m_,1 Hr,Valid
Shanghai,PM2.5,1/29/14 15:00,2014,1,29,15,44,µg/m_,1 Hr,Valid
Shanghai,PM2.5,1/29/14 16:00,2014,1,29,16,55,µg/m_,1 Hr,Valid
Shanghai,PM2.5,1/29/14 17:00,2014,1,29,17,56,µg/m_,1 Hr,Valid
Shanghai,PM2.5,1/29/14 18:00,2014,1,29,18,79,µg/m_,1 Hr,Valid
Shanghai,PM2.5,1/29/14 19:00,2014,1,29,19,88,µg/m_,1 Hr,Valid
Shanghai,PM2.5,1/29/14 20:00,2014,1,29,20,99,µg/m_,1 Hr,Valid
Shanghai,PM2.5,1/29/14 21:00,2014,1,29,21,105,µg/m_,1 Hr,Valid
Shanghai,PM2.5,1/29/14 22:00,2014,1,29,22,112,µg/m_,1 Hr,Valid
Shanghai,PM2.5,1/29/14 23:00,2014,1,29,23,120,µg/m_,1 Hr,Valid
Shanghai,PM2.5,1/30/14 00:00,2014,1,30,0,116,µg/m_,1 Hr,Valid
Shanghai,PM2.5,1/30/14 01:00,2014,1,30,1,132,µg/m_,1 Hr,Valid
Shanghai,PM2.5,1/30/14 02:00,2014,1,30,2,140,µg/m_,1 Hr,Valid
Shanghai,PM2.5,1/30/14 03:00,2014,1,30,3,137,µg/m_,1 Hr,Valid
Shanghai,PM2.5,1/30/14 04:00,2014,1,30,4,141,µg/m_,1 Hr,Valid
Shanghai,PM2.5,1/30/14 05:00,2014,1,30,5,167,µg/m_,1 Hr,Valid
Shanghai,PM2.5,1/30/14 06:00,2014,1,30,6,406,µg/m_,1 Hr,Valid
Shanghai,PM2.5,1/30/14 07:00,2014,1,30,7,163,µg/m_,1 Hr,Valid
Shanghai,PM2.5,1/30/14 08:00,2014,1,30,8,163,µg/m_,1 Hr,Valid
Shanghai,PM2.5,1/30/14 09:00,2014,1,30,9,161,µg/m_,1 Hr,Valid
Shanghai,PM2.5,1/30/14 10:00,2014,1,30,10,176,µg/m_,1 Hr,Valid
Shanghai,PM2.5,1/30/14 11:00,2014,1,30,11,172,µg/m_,1 Hr,Valid
Shanghai,PM2.5,1/30/14 12:00,2014,1,30,12,161,µg/m_,1 Hr,Valid
Shanghai,PM2.5,1/30/14 13:00,2014,1,30,13,152,µg/m_,1 Hr,Valid
Shanghai,PM2.5,1/30/14 14:00,2014,1,30,14,131,µg/m_,1 Hr,Valid
Shanghai,PM2.5,1/30/14 15:00,2014,1,30,15,127,µg/m_,1 Hr,Valid
Shanghai,PM2.5,1/30/14 16:00,2014,1,30,16,147,µg/m_,1 Hr,Valid
Shanghai,PM2.5,1/30/14 17:00,2014,1,30,17,221,µg/m_,1 Hr,Valid
Shanghai,PM2.5,1/30/14 18:00,2014,1,30,18,199,µg/m_,1 Hr,Valid
Shanghai,PM2.5,1/30/14 19:00,2014,1,30,19,238,µg/m_,1 Hr,Valid
Shanghai,PM2.5,1/30/14 20:00,2014,1,30,20,242,µg/m_,1 Hr,Valid
Shanghai,PM2.5,1/30/14 21:00,2014,1,30,21,222,µg/m_,1 Hr,Valid
Shanghai,PM2.5,1/30/14 22:00,2014,1,30,22,232,µg/m_,1 Hr,Valid
Shanghai,PM2.5,1/30/14 23:00,2014,1,30,23,238,µg/m_,1 Hr,Valid
Shanghai,PM2.5,1/31/14 00:00,2014,1,31,0,356,µg/m_,1 Hr,Valid
Shanghai,PM2.5,1/31/14 01:00,2014,1,31,1,230,µg/m_,1 Hr,Valid
Shanghai,PM2.5,1/31/14 02:00,2014,1,31,2,229,µg/m_,1 Hr,Valid
Shanghai,PM2.5,1/31/14 03:00,2014,1,31,3,199,µg/m_,1 Hr,Valid
Shanghai,PM2.5,1/31/14 04:00,2014,1,31,4,170,µg/m_,1 Hr,Valid
Shanghai,PM2.5,1/31/14 05:00,2014,1,31,5,143,µg/m_,1 Hr,Valid
Shanghai,PM2.5,1/31/14 06:00,2014,1,31,6,141,µg/m_,1 Hr,Valid
Shanghai,PM2.5,1/31/14 07:00,2014,1,31,7,156,µg/m_,1 Hr,Valid
Shanghai,PM2.5,1/31/14 08:00,2014,1,31,8,142,µg/m_,1 Hr,Valid
Shanghai,PM2.5,1/31/14 09:00,2014,1,31,9,119,µg/m_,1 Hr,Valid
Shanghai,PM2.5,1/31/14 10:00,2014,1,31,10,102,µg/m_,1 Hr,Valid
Shanghai,PM2.5,1/31/14 11:00,2014,1,31,11,96,µg/m_,1 Hr,Valid
Shanghai,PM2.5,1/31/14 12:00,2014,1,31,12,89,µg/m_,1 Hr,Valid
Shanghai,PM2.5,1/31/14 13:00,2014,1,31,13,87,µg/m_,1 Hr,Valid
Shanghai,PM2.5,1/31/14 14:00,2014,1,31,14,90,µg/m_,1 Hr,Valid
Shanghai,PM2.5,1/31/14 15:00,2014,1,31,15,83,µg/m_,1 Hr,Valid
Shanghai,PM2.5,1/31/14 16:00,2014,1,31,16,77,µg/m_,1 Hr,Valid
Shanghai,PM2.5,1/31/14 17:00,2014,1,31,17,78,µg/m_,1 Hr,Valid
Shanghai,PM2.5,1/31/14 18:00,2014,1,31,18,86,µg/m_,1 Hr,Valid
Shanghai,PM2.5,1/31/14 19:00,2014,1,31,19,76,µg/m_,1 Hr,Valid
Shanghai,PM2.5,1/31/14 20:00,2014,1,31,20,75,µg/m_,1 Hr,Valid
Shanghai,PM2.5,1/31/14 21:00,2014,1,31,21,64,µg/m_,1 Hr,Valid
Shanghai,PM2.5,1/31/14 22:00,2014,1,31,22,64,µg/m_,1 Hr,Valid
Shanghai,PM2.5,1/31/14 23:00,2014,1,31,23,61,µg/m_,1 Hr,Valid
Shanghai,PM2.5,2/1/14 00:00,2014,2,1,0,58,µg/m_,1 Hr,Valid
Shanghai,PM2.5,2/1/14 01:00,2014,2,1,1,55,µg/m_,1 Hr,Valid
Shanghai,PM2.5,2/1/14 02:00,2014,2,1,2,51,µg/m_,1 Hr,Valid
Shanghai,PM2.5,2/1/14 03:00,2014,2,1,3,46,µg/m_,1 Hr,Valid
Shanghai,PM2.5,2/1/14 04:00,2014,2,1,4,48,µg/m_,1 Hr,Valid
Shanghai,PM2.5,2/1/14 05:00,2014,2,1,5,43,µg/m_,1 Hr,Valid
Shanghai,PM2.5,2/1/14 06:00,2014,2,1,6,41,µg/m_,1 Hr,Valid
Shanghai,PM2.5,2/1/14 07:00,2014,2,1,7,37,µg/m_,1 Hr,Valid
Shanghai,PM2.5,2/1/14 08:00,2014,2,1,8,33,µg/m_,1 Hr,Valid
Shanghai,PM2.5,2/1/14 09:00,2014,2,1,9,38,µg/m_,1 Hr,Valid
Shanghai,PM2.5,2/1/14 10:00,2014,2,1,10,38,µg/m_,1 Hr,Valid
Shanghai,PM2.5,2/1/14 11:00,2014,2,1,11,40,µg/m_,1 Hr,Valid
Shanghai,PM2.5,2/1/14 12:00,2014,2,1,12,54,µg/m_,1 Hr,Valid
Shanghai,PM2.5,2/1/14 13:00,2014,2,1,13,55,µg/m_,1 Hr,Valid
Shanghai,PM2.5,2/1/14 14:00,2014,2,1,14,52,µg/m_,1 Hr,Valid
Shanghai,PM2.5,2/1/14 15:00,2014,2,1,15,58,µg/m_,1 Hr,Valid
Shanghai,PM2.5,2/1/14 16:00,2014,2,1,16,66,µg/m_,1 Hr,Valid
Shanghai,PM2.5,2/1/14 17:00,2014,2,1,17,61,µg/m_,1 Hr,Valid
Shanghai,PM2.5,2/1/14 18:00,2014,2,1,18,74,µg/m_,1 Hr,Valid
Shanghai,PM2.5,2/1/14 19:00,2014,2,1,19,92,µg/m_,1 Hr,Valid
Shanghai,PM2.5,2/1/14 20:00,2014,2,1,20,96,µg/m_,1 Hr,Valid
Shanghai,PM2.5,2/1/14 21:00,2014,2,1,21,108,µg/m_,1 Hr,Valid
Shanghai,PM2.5,2/1/14 22:00,2014,2,1,22,120,µg/m_,1 Hr,Valid
Shanghai,PM2.5,2/1/14 23:00,2014,2,1,23,117,µg/m_,1 Hr,Valid
Shanghai,PM2.5,2/2/14 00:00,2014,2,2,0,164,µg/m_,1 Hr,Valid
Shanghai,PM2.5,2/2/14 01:00,2014,2,2,1,184,µg/m_,1 Hr,Valid
Shanghai,PM2.5,2/2/14 02:00,2014,2,2,2,180,µg/m_,1 Hr,Valid
Shanghai,PM2.5,2/2/14 03:00,2014,2,2,3,206,µg/m_,1 Hr,Valid
Shanghai,PM2.5,2/2/14 04:00,2014,2,2,4,191,µg/m_,1 Hr,Valid
Shanghai,PM2.5,2/2/14 05:00,2014,2,2,5,237,µg/m_,1 Hr,Valid
Shanghai,PM2.5,2/2/14 06:00,2014,2,2,6,241,µg/m_,1 Hr,Valid
Shanghai,PM2.5,2/2/14 07:00,2014,2,2,7,254,µg/m_,1 Hr,Valid
Shanghai,PM2.5,2/2/14 08:00,2014,2,2,8,263,µg/m_,1 Hr,Valid
Shanghai,PM2.5,2/2/14 09:00,2014,2,2,9,268,µg/m_,1 Hr,Valid
Shanghai,PM2.5,2/2/14 10:00,2014,2,2,10,265,µg/m_,1 Hr,Valid
Shanghai,PM2.5,2/2/14 11:00,2014,2,2,11,265,µg/m_,1 Hr,Valid
Shanghai,PM2.5,2/2/14 12:00,2014,2,2,12,245,µg/m_,1 Hr,Valid
Shanghai,PM2.5,2/2/14 13:00,2014,2,2,13,191,µg/m_,1 Hr,Valid
Shanghai,PM2.5,2/2/14 14:00,2014,2,2,14,154,µg/m_,1 Hr,Valid
Shanghai,PM2.5,2/2/14 15:00,2014,2,2,15,140,µg/m_,1 Hr,Valid
Shanghai,PM2.5,2/2/14 16:00,2014,2,2,16,117,µg/m_,1 Hr,Valid
Shanghai,PM2.5,2/2/14 17:00,2014,2,2,17,113,µg/m_,1 Hr,Valid
Shanghai,PM2.5,2/2/14 18:00,2014,2,2,18,128,µg/m_,1 Hr,Valid
Shanghai,PM2.5,2/2/14 19:00,2014,2,2,19,119,µg/m_,1 Hr,Valid
Shanghai,PM2.5,2/2/14 20:00,2014,2,2,20,87,µg/m_,1 Hr,Valid
Shanghai,PM2.5,2/2/14 21:00,2014,2,2,21,78,µg/m_,1 Hr,Valid
Shanghai,PM2.5,2/2/14 22:00,2014,2,2,22,79,µg/m_,1 Hr,Valid
Shanghai,PM2.5,2/2/14 23:00,2014,2,2,23,79,µg/m_,1 Hr,Valid
Shanghai,PM2.5,2/3/14 00:00,2014,2,3,0,77,µg/m_,1 Hr,Valid
Shanghai,PM2.5,2/3/14 01:00,2014,2,3,1,76,µg/m_,1 Hr,Valid
Shanghai,PM2.5,2/3/14 02:00,2014,2,3,2,72,µg/m_,1 Hr,Valid
Shanghai,PM2.5,2/3/14 03:00,2014,2,3,3,64,µg/m_,1 Hr,Valid
Shanghai,PM2.5,2/3/14 04:00,2014,2,3,4,54,µg/m_,1 Hr,Valid
Shanghai,PM2.5,2/3/14 05:00,2014,2,3,5,61,µg/m_,1 Hr,Valid
Shanghai,PM2.5,2/3/14 06:00,2014,2,3,6,92,µg/m_,1 Hr,Valid
Shanghai,PM2.5,2/3/14 07:00,2014,2,3,7,100,µg/m_,1 Hr,Valid
Shanghai,PM2.5,2/3/14 08:00,2014,2,3,8,95,µg/m_,1 Hr,Valid
Shanghai,PM2.5,2/3/14 09:00,2014,2,3,9,65,µg/m_,1 Hr,Valid
Shanghai,PM2.5,2/3/14 10:00,2014,2,3,10,81,µg/m_,1 Hr,Valid
Shanghai,PM2.5,2/3/14 11:00,2014,2,3,11,54,µg/m_,1 Hr,Valid
Shanghai,PM2.5,2/3/14 12:00,2014,2,3,12,27,µg/m_,1 Hr,Valid
Shanghai,PM2.5,2/3/14 13:00,2014,2,3,13,26,µg/m_,1 Hr,Valid
Shanghai,PM2.5,2/3/14 14:00,2014,2,3,14,23,µg/m_,1 Hr,Valid
Shanghai,PM2.5,2/3/14 15:00,2014,2,3,15,30,µg/m_,1 Hr,Valid
Shanghai,PM2.5,2/3/14 16:00,2014,2,3,16,29,µg/m_,1 Hr,Valid
Shanghai,PM2.5,2/3/14 17:00,2014,2,3,17,28,µg/m_,1 Hr,Valid
Shanghai,PM2.5,2/3/14 18:00,2014,2,3,18,27,µg/m_,1 Hr,Valid
Shanghai,PM2.5,2/3/14 19:00,2014,2,3,19,22,µg/m_,1 Hr,Valid
Shanghai,PM2.5,2/3/14 20:00,2014,2,3,20,36,µg/m_,1 Hr,Valid
Shanghai,PM2.5,2/3/14 21:00,2014,2,3,21,25,µg/m_,1 Hr,Valid
Shanghai,PM2.5,2/3/14 22:00,2014,2,3,22,25,µg/m_,1 Hr,Valid
Shanghai,PM2.5,2/3/14 23:00,2014,2,3,23,29,µg/m_,1 Hr,Valid
Shanghai,PM2.5,2/4/14 00:00,2014,2,4,0,139,µg/m_,1 Hr,Valid
Shanghai,PM2.5,2/4/14 01:00,2014,2,4,1,24,µg/m_,1 Hr,Valid
Shanghai,PM2.5,2/4/14 02:00,2014,2,4,2,18,µg/m_,1 Hr,Valid
Shanghai,PM2.5,2/4/14 03:00,2014,2,4,3,18,µg/m_,1 Hr,Valid
Shanghai,PM2.5,2/4/14 04:00,2014,2,4,4,17,µg/m_,1 Hr,Valid
Shanghai,PM2.5,2/4/14 05:00,2014,2,4,5,17,µg/m_,1 Hr,Valid
Shanghai,PM2.5,2/4/14 06:00,2014,2,4,6,17,µg/m_,1 Hr,Valid
Shanghai,PM2.5,2/4/14 07:00,2014,2,4,7,21,µg/m_,1 Hr,Valid
Shanghai,PM2.5,2/4/14 08:00,2014,2,4,8,22,µg/m_,1 Hr,Valid
Shanghai,PM2.5,2/4/14 09:00,2014,2,4,9,22,µg/m_,1 Hr,Valid
Shanghai,PM2.5,2/4/14 10:00,2014,2,4,10,24,µg/m_,1 Hr,Valid
Shanghai,PM2.5,2/4/14 11:00,2014,2,4,11,18,µg/m_,1 Hr,Valid
Shanghai,PM2.5,2/4/14 12:00,2014,2,4,12,25,µg/m_,1 Hr,Valid
Shanghai,PM2.5,2/4/14 13:00,2014,2,4,13,23,µg/m_,1 Hr,Valid
Shanghai,PM2.5,2/4/14 14:00,2014,2,4,14,25,µg/m_,1 Hr,Valid
Shanghai,PM2.5,2/4/14 15:00,2014,2,4,15,24,µg/m_,1 Hr,Valid
Shanghai,PM2.5,2/4/14 16:00,2014,2,4,16,16,µg/m_,1 Hr,Valid
Shanghai,PM2.5,2/4/14 17:00,2014,2,4,17,23,µg/m_,1 Hr,Valid
Shanghai,PM2.5,2/4/14 18:00,2014,2,4,18,24,µg/m_,1 Hr,Valid
Shanghai,PM2.5,2/4/14 19:00,2014,2,4,19,20,µg/m_,1 Hr,Valid
Shanghai,PM2.5,2/4/14 20:00,2014,2,4,20,18,µg/m_,1 Hr,Valid
Shanghai,PM2.5,2/4/14 21:00,2014,2,4,21,19,µg/m_,1 Hr,Valid
Shanghai,PM2.5,2/4/14 22:00,2014,2,4,22,21,µg/m_,1 Hr,Valid
Shanghai,PM2.5,2/4/14 23:00,2014,2,4,23,17,µg/m_,1 Hr,Valid
Shanghai,PM2.5,2/5/14 00:00,2014,2,5,0,21,µg/m_,1 Hr,Valid
Shanghai,PM2.5,2/5/14 01:00,2014,2,5,1,23,µg/m_,1 Hr,Valid
Shanghai,PM2.5,2/5/14 02:00,2014,2,5,2,19,µg/m_,1 Hr,Valid
Shanghai,PM2.5,2/5/14 03:00,2014,2,5,3,18,µg/m_,1 Hr,Valid
Shanghai,PM2.5,2/5/14 04:00,2014,2,5,4,21,µg/m_,1 Hr,Valid
Shanghai,PM2.5,2/5/14 05:00,2014,2,5,5,25,µg/m_,1 Hr,Valid
Shanghai,PM2.5,2/5/14 06:00,2014,2,5,6,17,µg/m_,1 Hr,Valid
Shanghai,PM2.5,2/5/14 07:00,2014,2,5,7,16,µg/m_,1 Hr,Valid
Shanghai,PM2.5,2/5/14 08:00,2014,2,5,8,20,µg/m_,1 Hr,Valid
Shanghai,PM2.5,2/5/14 09:00,2014,2,5,9,16,µg/m_,1 Hr,Valid
Shanghai,PM2.5,2/5/14 10:00,2014,2,5,10,20,µg/m_,1 Hr,Valid
Shanghai,PM2.5,2/5/14 11:00,2014,2,5,11,17,µg/m_,1 Hr,Valid
Shanghai,PM2.5,2/5/14 12:00,2014,2,5,12,23,µg/m_,1 Hr,Valid
Shanghai,PM2.5,2/5/14 13:00,2014,2,5,13,20,µg/m_,1 Hr,Valid
Shanghai,PM2.5,2/5/14 14:00,2014,2,5,14,16,µg/m_,1 Hr,Valid
Shanghai,PM2.5,2/5/14 15:00,2014,2,5,15,17,µg/m_,1 Hr,Valid
Shanghai,PM2.5,2/5/14 16:00,2014,2,5,16,13,µg/m_,1 Hr,Valid
Shanghai,PM2.5,2/5/14 17:00,2014,2,5,17,17,µg/m_,1 Hr,Valid
Shanghai,PM2.5,2/5/14 18:00,2014,2,5,18,18,µg/m_,1 Hr,Valid
Shanghai,PM2.5,2/5/14 19:00,2014,2,5,19,17,µg/m_,1 Hr,Valid
Shanghai,PM2.5,2/5/14 20:00,2014,2,5,20,20,µg/m_,1 Hr,Valid
Shanghai,PM2.5,2/5/14 21:00,2014,2,5,21,22,µg/m_,1 Hr,Valid
Shanghai,PM2.5,2/5/14 22:00,2014,2,5,22,16,µg/m_,1 Hr,Valid
Shanghai,PM2.5,2/5/14 23:00,2014,2,5,23,22,µg/m_,1 Hr,Valid
Shanghai,PM2.5,2/6/14 00:00,2014,2,6,0,18,µg/m_,1 Hr,Valid
Shanghai,PM2.5,2/6/14 01:00,2014,2,6,1,14,µg/m_,1 Hr,Valid
Shanghai,PM2.5,2/6/14 02:00,2014,2,6,2,14,µg/m_,1 Hr,Valid
Shanghai,PM2.5,2/6/14 03:00,2014,2,6,3,17,µg/m_,1 Hr,Valid
Shanghai,PM2.5,2/6/14 04:00,2014,2,6,4,19,µg/m_,1 Hr,Valid
Shanghai,PM2.5,2/6/14 05:00,2014,2,6,5,17,µg/m_,1 Hr,Valid
Shanghai,PM2.5,2/6/14 06:00,2014,2,6,6,16,µg/m_,1 Hr,Valid
Shanghai,PM2.5,2/6/14 07:00,2014,2,6,7,10,µg/m_,1 Hr,Valid
Shanghai,PM2.5,2/6/14 08:00,2014,2,6,8,11,µg/m_,1 Hr,Valid
Shanghai,PM2.5,2/6/14 09:00,2014,2,6,9,17,µg/m_,1 Hr,Valid
Shanghai,PM2.5,2/6/14 10:00,2014,2,6,10,13,µg/m_,1 Hr,Valid
Shanghai,PM2.5,2/6/14 11:00,2014,2,6,11,14,µg/m_,1 Hr,Valid
Shanghai,PM2.5,2/6/14 12:00,2014,2,6,12,13,µg/m_,1 Hr,Valid
Shanghai,PM2.5,2/6/14 13:00,2014,2,6,13,11,µg/m_,1 Hr,Valid
Shanghai,PM2.5,2/6/14 14:00,2014,2,6,14,16,µg/m_,1 Hr,Valid
Shanghai,PM2.5,2/6/14 15:00,2014,2,6,15,10,µg/m_,1 Hr,Valid
Shanghai,PM2.5,2/6/14 16:00,2014,2,6,16,10,µg/m_,1 Hr,Valid
Shanghai,PM2.5,2/6/14 17:00,2014,2,6,17,15,µg/m_,1 Hr,Valid
Shanghai,PM2.5,2/6/14 18:00,2014,2,6,18,19,µg/m_,1 Hr,Valid
Shanghai,PM2.5,2/6/14 19:00,2014,2,6,19,16,µg/m_,1 Hr,Valid
Shanghai,PM2.5,2/6/14 20:00,2014,2,6,20,13,µg/m_,1 Hr,Valid
Shanghai,PM2.5,2/6/14 21:00,2014,2,6,21,13,µg/m_,1 Hr,Valid
Shanghai,PM2.5,2/6/14 22:00,2014,2,6,22,14,µg/m_,1 Hr,Valid
Shanghai,PM2.5,2/6/14 23:00,2014,2,6,23,12,µg/m_,1 Hr,Valid
Shanghai,PM2.5,2/7/14 00:00,2014,2,7,0,10,µg/m_,1 Hr,Valid
Shanghai,PM2.5,2/7/14 01:00,2014,2,7,1,10,µg/m_,1 Hr,Valid
Shanghai,PM2.5,2/7/14 02:00,2014,2,7,2,10,µg/m_,1 Hr,Valid
Shanghai,PM2.5,2/7/14 03:00,2014,2,7,3,16,µg/m_,1 Hr,Valid
Shanghai,PM2.5,2/7/14 04:00,2014,2,7,4,15,µg/m_,1 Hr,Valid
Shanghai,PM2.5,2/7/14 05:00,2014,2,7,5,16,µg/m_,1 Hr,Valid
Shanghai,PM2.5,2/7/14 06:00,2014,2,7,6,16,µg/m_,1 Hr,Valid
Shanghai,PM2.5,2/7/14 07:00,2014,2,7,7,12,µg/m_,1 Hr,Valid
Shanghai,PM2.5,2/7/14 08:00,2014,2,7,8,22,µg/m_,1 Hr,Valid
Shanghai,PM2.5,2/7/14 09:00,2014,2,7,9,21,µg/m_,1 Hr,Valid
Shanghai,PM2.5,2/7/14 10:00,2014,2,7,10,17,µg/m_,1 Hr,Valid
Shanghai,PM2.5,2/7/14 11:00,2014,2,7,11,20,µg/m_,1 Hr,Valid
Shanghai,PM2.5,2/7/14 12:00,2014,2,7,12,17,µg/m_,1 Hr,Valid
Shanghai,PM2.5,2/7/14 13:00,2014,2,7,13,19,µg/m_,1 Hr,Valid
Shanghai,PM2.5,2/7/14 14:00,2014,2,7,14,22,µg/m_,1 Hr,Valid
Shanghai,PM2.5,2/7/14 15:00,2014,2,7,15,21,µg/m_,1 Hr,Valid
Shanghai,PM2.5,2/7/14 16:00,2014,2,7,16,20,µg/m_,1 Hr,Valid
Shanghai,PM2.5,2/7/14 17:00,2014,2,7,17,18,µg/m_,1 Hr,Valid
Shanghai,PM2.5,2/7/14 18:00,2014,2,7,18,18,µg/m_,1 Hr,Valid
Shanghai,PM2.5,2/7/14 19:00,2014,2,7,19,14,µg/m_,1 Hr,Valid
Shanghai,PM2.5,2/7/14 20:00,2014,2,7,20,23,µg/m_,1 Hr,Valid
Shanghai,PM2.5,2/7/14 21:00,2014,2,7,21,25,µg/m_,1 Hr,Valid
Shanghai,PM2.5,2/7/14 22:00,2014,2,7,22,20,µg/m_,1 Hr,Valid
Shanghai,PM2.5,2/7/14 23:00,2014,2,7,23,17,µg/m_,1 Hr,Valid
Shanghai,PM2.5,2/8/14 00:00,2014,2,8,0,17,µg/m_,1 Hr,Valid
Shanghai,PM2.5,2/8/14 01:00,2014,2,8,1,20,µg/m_,1 Hr,Valid
Shanghai,PM2.5,2/8/14 02:00,2014,2,8,2,23,µg/m_,1 Hr,Valid
Shanghai,PM2.5,2/8/14 03:00,2014,2,8,3,32,µg/m_,1 Hr,Valid
Shanghai,PM2.5,2/8/14 04:00,2014,2,8,4,37,µg/m_,1 Hr,Valid
Shanghai,PM2.5,2/8/14 05:00,2014,2,8,5,50,µg/m_,1 Hr,Valid
Shanghai,PM2.5,2/8/14 06:00,2014,2,8,6,73,µg/m_,1 Hr,Valid
Shanghai,PM2.5,2/8/14 07:00,2014,2,8,7,55,µg/m_,1 Hr,Valid
Shanghai,PM2.5,2/8/14 08:00,2014,2,8,8,55,µg/m_,1 Hr,Valid
Shanghai,PM2.5,2/8/14 09:00,2014,2,8,9,57,µg/m_,1 Hr,Valid
Shanghai,PM2.5,2/8/14 10:00,2014,2,8,10,58,µg/m_,1 Hr,Valid
Shanghai,PM2.5,2/8/14 11:00,2014,2,8,11,60,µg/m_,1 Hr,Valid
Shanghai,PM2.5,2/8/14 12:00,2014,2,8,12,57,µg/m_,1 Hr,Valid
Shanghai,PM2.5,2/8/14 13:00,2014,2,8,13,63,µg/m_,1 Hr,Valid
Shanghai,PM2.5,2/8/14 14:00,2014,2,8,14,58,µg/m_,1 Hr,Valid
Shanghai,PM2.5,2/8/14 15:00,2014,2,8,15,53,µg/m_,1 Hr,Valid
Shanghai,PM2.5,2/8/14 16:00,2014,2,8,16,53,µg/m_,1 Hr,Valid
Shanghai,PM2.5,2/8/14 17:00,2014,2,8,17,48,µg/m_,1 Hr,Valid
Shanghai,PM2.5,2/8/14 18:00,2014,2,8,18,40,µg/m_,1 Hr,Valid
Shanghai,PM2.5,2/8/14 19:00,2014,2,8,19,32,µg/m_,1 Hr,Valid
Shanghai,PM2.5,2/8/14 20:00,2014,2,8,20,33,µg/m_,1 Hr,Valid
Shanghai,PM2.5,2/8/14 21:00,2014,2,8,21,36,µg/m_,1 Hr,Valid
Shanghai,PM2.5,2/8/14 22:00,2014,2,8,22,42,µg/m_,1 Hr,Valid
Shanghai,PM2.5,2/8/14 23:00,2014,2,8,23,39,µg/m_,1 Hr,Valid
Shanghai,PM2.5,2/9/14 00:00,2014,2,9,0,35,µg/m_,1 Hr,Valid
Shanghai,PM2.5,2/9/14 01:00,2014,2,9,1,51,µg/m_,1 Hr,Valid
Shanghai,PM2.5,2/9/14 02:00,2014,2,9,2,57,µg/m_,1 Hr,Valid
Shanghai,PM2.5,2/9/14 03:00,2014,2,9,3,68,µg/m_,1 Hr,Valid
Shanghai,PM2.5,2/9/14 04:00,2014,2,9,4,71,µg/m_,1 Hr,Valid
Shanghai,PM2.5,2/9/14 05:00,2014,2,9,5,76,µg/m_,1 Hr,Valid
Shanghai,PM2.5,2/9/14 06:00,2014,2,9,6,75,µg/m_,1 Hr,Valid
Shanghai,PM2.5,2/9/14 07:00,2014,2,9,7,59,µg/m_,1 Hr,Valid
Shanghai,PM2.5,2/9/14 08:00,2014,2,9,8,45,µg/m_,1 Hr,Valid
Shanghai,PM2.5,2/9/14 09:00,2014,2,9,9,43,µg/m_,1 Hr,Valid
Shanghai,PM2.5,2/9/14 10:00,2014,2,9,10,54,µg/m_,1 Hr,Valid
Shanghai,PM2.5,2/9/14 11:00,2014,2,9,11,64,µg/m_,1 Hr,Valid
Shanghai,PM2.5,2/9/14 12:00,2014,2,9,12,63,µg/m_,1 Hr,Valid
Shanghai,PM2.5,2/9/14 13:00,2014,2,9,13,56,µg/m_,1 Hr,Valid
Shanghai,PM2.5,2/9/14 14:00,2014,2,9,14,48,µg/m_,1 Hr,Valid
Shanghai,PM2.5,2/9/14 15:00,2014,2,9,15,43,µg/m_,1 Hr,Valid
Shanghai,PM2.5,2/9/14 16:00,2014,2,9,16,41,µg/m_,1 Hr,Valid
Shanghai,PM2.5,2/9/14 17:00,2014,2,9,17,33,µg/m_,1 Hr,Valid
Shanghai,PM2.5,2/9/14 18:00,2014,2,9,18,35,µg/m_,1 Hr,Valid
Shanghai,PM2.5,2/9/14 19:00,2014,2,9,19,31,µg/m_,1 Hr,Valid
Shanghai,PM2.5,2/9/14 20:00,2014,2,9,20,28,µg/m_,1 Hr,Valid
Shanghai,PM2.5,2/9/14 21:00,2014,2,9,21,26,µg/m_,1 Hr,Valid
Shanghai,PM2.5,2/9/14 22:00,2014,2,9,22,27,µg/m_,1 Hr,Valid
Shanghai,PM2.5,2/9/14 23:00,2014,2,9,23,25,µg/m_,1 Hr,Valid
Shanghai,PM2.5,2/10/14 00:00,2014,2,10,0,23,µg/m_,1 Hr,Valid
Shanghai,PM2.5,2/10/14 01:00,2014,2,10,1,26,µg/m_,1 Hr,Valid
Shanghai,PM2.5,2/10/14 02:00,2014,2,10,2,30,µg/m_,1 Hr,Valid
Shanghai,PM2.5,2/10/14 03:00,2014,2,10,3,31,µg/m_,1 Hr,Valid
Shanghai,PM2.5,2/10/14 04:00,2014,2,10,4,29,µg/m_,1 Hr,Valid
Shanghai,PM2.5,2/10/14 05:00,2014,2,10,5,28,µg/m_,1 Hr,Valid
Shanghai,PM2.5,2/10/14 06:00,2014,2,10,6,32,µg/m_,1 Hr,Valid
Shanghai,PM2.5,2/10/14 07:00,2014,2,10,7,35,µg/m_,1 Hr,Valid
Shanghai,PM2.5,2/10/14 08:00,2014,2,10,8,38,µg/m_,1 Hr,Valid
Shanghai,PM2.5,2/10/14 09:00,2014,2,10,9,35,µg/m_,1 Hr,Valid
Shanghai,PM2.5,2/10/14 10:00,2014,2,10,10,37,µg/m_,1 Hr,Valid
Shanghai,PM2.5,2/10/14 11:00,2014,2,10,11,40,µg/m_,1 Hr,Valid
Shanghai,PM2.5,2/10/14 12:00,2014,2,10,12,42,µg/m_,1 Hr,Valid
Shanghai,PM2.5,2/10/14 13:00,2014,2,10,13,40,µg/m_,1 Hr,Valid
Shanghai,PM2.5,2/10/14 14:00,2014,2,10,14,41,µg/m_,1 Hr,Valid
Shanghai,PM2.5,2/10/14 15:00,2014,2,10,15,38,µg/m_,1 Hr,Valid
Shanghai,PM2.5,2/10/14 16:00,2014,2,10,16,33,µg/m_,1 Hr,Valid
Shanghai,PM2.5,2/10/14 17:00,2014,2,10,17,31,µg/m_,1 Hr,Valid
Shanghai,PM2.5,2/10/14 18:00,2014,2,10,18,35,µg/m_,1 Hr,Valid
Shanghai,PM2.5,2/10/14 19:00,2014,2,10,19,32,µg/m_,1 Hr,Valid
Shanghai,PM2.5,2/10/14 20:00,2014,2,10,20,27,µg/m_,1 Hr,Valid
Shanghai,PM2.5,2/10/14 21:00,2014,2,10,21,28,µg/m_,1 Hr,Valid
Shanghai,PM2.5,2/10/14 22:00,2014,2,10,22,30,µg/m_,1 Hr,Valid
Shanghai,PM2.5,2/10/14 23:00,2014,2,10,23,32,µg/m_,1 Hr,Valid
Shanghai,PM2.5,2/11/14 00:00,2014,2,11,0,21,µg/m_,1 Hr,Valid
Shanghai,PM2.5,2/11/14 01:00,2014,2,11,1,31,µg/m_,1 Hr,Valid
Shanghai,PM2.5,2/11/14 02:00,2014,2,11,2,29,µg/m_,1 Hr,Valid
Shanghai,PM2.5,2/11/14 03:00,2014,2,11,3,28,µg/m_,1 Hr,Valid
Shanghai,PM2.5,2/11/14 04:00,2014,2,11,4,31,µg/m_,1 Hr,Valid
Shanghai,PM2.5,2/11/14 05:00,2014,2,11,5,34,µg/m_,1 Hr,Valid
Shanghai,PM2.5,2/11/14 06:00,2014,2,11,6,39,µg/m_,1 Hr,Valid
Shanghai,PM2.5,2/11/14 07:00,2014,2,11,7,48,µg/m_,1 Hr,Valid
Shanghai,PM2.5,2/11/14 08:00,2014,2,11,8,55,µg/m_,1 Hr,Valid
Shanghai,PM2.5,2/11/14 09:00,2014,2,11,9,52,µg/m_,1 Hr,Valid
Shanghai,PM2.5,2/11/14 10:00,2014,2,11,10,45,µg/m_,1 Hr,Valid
Shanghai,PM2.5,2/11/14 11:00,2014,2,11,11,40,µg/m_,1 Hr,Valid
Shanghai,PM2.5,2/11/14 12:00,2014,2,11,12,43,µg/m_,1 Hr,Valid
Shanghai,PM2.5,2/11/14 13:00,2014,2,11,13,33,µg/m_,1 Hr,Valid
Shanghai,PM2.5,2/11/14 14:00,2014,2,11,14,42,µg/m_,1 Hr,Valid
Shanghai,PM2.5,2/11/14 15:00,2014,2,11,15,52,µg/m_,1 Hr,Valid
Shanghai,PM2.5,2/11/14 16:00,2014,2,11,16,52,µg/m_,1 Hr,Valid
Shanghai,PM2.5,2/11/14 17:00,2014,2,11,17,56,µg/m_,1 Hr,Valid
Shanghai,PM2.5,2/11/14 18:00,2014,2,11,18,47,µg/m_,1 Hr,Valid
Shanghai,PM2.5,2/11/14 19:00,2014,2,11,19,32,µg/m_,1 Hr,Valid
Shanghai,PM2.5,2/11/14 20:00,2014,2,11,20,40,µg/m_,1 Hr,Valid
Shanghai,PM2.5,2/11/14 21:00,2014,2,11,21,34,µg/m_,1 Hr,Valid
Shanghai,PM2.5,2/11/14 22:00,2014,2,11,22,32,µg/m_,1 Hr,Valid
Shanghai,PM2.5,2/11/14 23:00,2014,2,11,23,29,µg/m_,1 Hr,Valid
Shanghai,PM2.5,2/12/14 00:00,2014,2,12,0,37,µg/m_,1 Hr,Valid
Shanghai,PM2.5,2/12/14 01:00,2014,2,12,1,24,µg/m_,1 Hr,Valid
Shanghai,PM2.5,2/12/14 02:00,2014,2,12,2,30,µg/m_,1 Hr,Valid
Shanghai,PM2.5,2/12/14 03:00,2014,2,12,3,24,µg/m_,1 Hr,Valid
Shanghai,PM2.5,2/12/14 04:00,2014,2,12,4,27,µg/m_,1 Hr,Valid
Shanghai,PM2.5,2/12/14 05:00,2014,2,12,5,28,µg/m_,1 Hr,Valid
Shanghai,PM2.5,2/12/14 06:00,2014,2,12,6,34,µg/m_,1 Hr,Valid
Shanghai,PM2.5,2/12/14 07:00,2014,2,12,7,33,µg/m_,1 Hr,Valid
Shanghai,PM2.5,2/12/14 08:00,2014,2,12,8,40,µg/m_,1 Hr,Valid
Shanghai,PM2.5,2/12/14 09:00,2014,2,12,9,43,µg/m_,1 Hr,Valid
Shanghai,PM2.5,2/12/14 10:00,2014,2,12,10,51,µg/m_,1 Hr,Valid
Shanghai,PM2.5,2/12/14 11:00,2014,2,12,11,48,µg/m_,1 Hr,Valid
Shanghai,PM2.5,2/12/14 12:00,2014,2,12,12,43,µg/m_,1 Hr,Valid
Shanghai,PM2.5,2/12/14 13:00,2014,2,12,13,30,µg/m_,1 Hr,Valid
Shanghai,PM2.5,2/12/14 14:00,2014,2,12,14,23,µg/m_,1 Hr,Valid
Shanghai,PM2.5,2/12/14 15:00,2014,2,12,15,23,µg/m_,1 Hr,Valid
Shanghai,PM2.5,2/12/14 16:00,2014,2,12,16,22,µg/m_,1 Hr,Valid
Shanghai,PM2.5,2/12/14 17:00,2014,2,12,17,27,µg/m_,1 Hr,Valid
Shanghai,PM2.5,2/12/14 18:00,2014,2,12,18,32,µg/m_,1 Hr,Valid
Shanghai,PM2.5,2/12/14 19:00,2014,2,12,19,23,µg/m_,1 Hr,Valid
Shanghai,PM2.5,2/12/14 20:00,2014,2,12,20,32,µg/m_,1 Hr,Valid
Shanghai,PM2.5,2/12/14 21:00,2014,2,12,21,23,µg/m_,1 Hr,Valid
Shanghai,PM2.5,2/12/14 22:00,2014,2,12,22,24,µg/m_,1 Hr,Valid
Shanghai,PM2.5,2/12/14 23:00,2014,2,12,23,23,µg/m_,1 Hr,Valid
Shanghai,PM2.5,2/13/14 00:00,2014,2,13,0,24,µg/m_,1 Hr,Valid
Shanghai,PM2.5,2/13/14 01:00,2014,2,13,1,24,µg/m_,1 Hr,Valid
Shanghai,PM2.5,2/13/14 02:00,2014,2,13,2,19,µg/m_,1 Hr,Valid
Shanghai,PM2.5,2/13/14 03:00,2014,2,13,3,24,µg/m_,1 Hr,Valid
Shanghai,PM2.5,2/13/14 04:00,2014,2,13,4,36,µg/m_,1 Hr,Valid
Shanghai,PM2.5,2/13/14 05:00,2014,2,13,5,45,µg/m_,1 Hr,Valid
Shanghai,PM2.5,2/13/14 06:00,2014,2,13,6,49,µg/m_,1 Hr,Valid
Shanghai,PM2.5,2/13/14 07:00,2014,2,13,7,45,µg/m_,1 Hr,Valid
Shanghai,PM2.5,2/13/14 08:00,2014,2,13,8,35,µg/m_,1 Hr,Valid
Shanghai,PM2.5,2/13/14 09:00,2014,2,13,9,27,µg/m_,1 Hr,Valid
Shanghai,PM2.5,2/13/14 10:00,2014,2,13,10,20,µg/m_,1 Hr,Valid
Shanghai,PM2.5,2/13/14 11:00,2014,2,13,11,18,µg/m_,1 Hr,Valid
Shanghai,PM2.5,2/13/14 12:00,2014,2,13,12,25,µg/m_,1 Hr,Valid
Shanghai,PM2.5,2/13/14 13:00,2014,2,13,13,22,µg/m_,1 Hr,Valid
Shanghai,PM2.5,2/13/14 14:00,2014,2,13,14,20,µg/m_,1 Hr,Valid
Shanghai,PM2.5,2/13/14 15:00,2014,2,13,15,24,µg/m_,1 Hr,Valid
Shanghai,PM2.5,2/13/14 16:00,2014,2,13,16,27,µg/m_,1 Hr,Valid
Shanghai,PM2.5,2/13/14 17:00,2014,2,13,17,27,µg/m_,1 Hr,Valid
Shanghai,PM2.5,2/13/14 18:00,2014,2,13,18,30,µg/m_,1 Hr,Valid
Shanghai,PM2.5,2/13/14 19:00,2014,2,13,19,27,µg/m_,1 Hr,Valid
Shanghai,PM2.5,2/13/14 20:00,2014,2,13,20,29,µg/m_,1 Hr,Valid
Shanghai,PM2.5,2/13/14 21:00,2014,2,13,21,25,µg/m_,1 Hr,Valid
Shanghai,PM2.5,2/13/14 22:00,2014,2,13,22,23,µg/m_,1 Hr,Valid
Shanghai,PM2.5,2/13/14 23:00,2014,2,13,23,26,µg/m_,1 Hr,Valid
Shanghai,PM2.5,2/14/14 00:00,2014,2,14,0,26,µg/m_,1 Hr,Valid
Shanghai,PM2.5,2/14/14 01:00,2014,2,14,1,34,µg/m_,1 Hr,Valid
Shanghai,PM2.5,2/14/14 02:00,2014,2,14,2,38,µg/m_,1 Hr,Valid
Shanghai,PM2.5,2/14/14 03:00,2014,2,14,3,35,µg/m_,1 Hr,Valid
Shanghai,PM2.5,2/14/14 04:00,2014,2,14,4,32,µg/m_,1 Hr,Valid
Shanghai,PM2.5,2/14/14 05:00,2014,2,14,5,39,µg/m_,1 Hr,Valid
Shanghai,PM2.5,2/14/14 06:00,2014,2,14,6,39,µg/m_,1 Hr,Valid
Shanghai,PM2.5,2/14/14 07:00,2014,2,14,7,47,µg/m_,1 Hr,Valid
Shanghai,PM2.5,2/14/14 08:00,2014,2,14,8,47,µg/m_,1 Hr,Valid
Shanghai,PM2.5,2/14/14 09:00,2014,2,14,9,48,µg/m_,1 Hr,Valid
Shanghai,PM2.5,2/14/14 10:00,2014,2,14,10,33,µg/m_,1 Hr,Valid
Shanghai,PM2.5,2/14/14 11:00,2014,2,14,11,31,µg/m_,1 Hr,Valid
Shanghai,PM2.5,2/14/14 12:00,2014,2,14,12,32,µg/m_,1 Hr,Valid
Shanghai,PM2.5,2/14/14 13:00,2014,2,14,13,35,µg/m_,1 Hr,Valid
Shanghai,PM2.5,2/14/14 14:00,2014,2,14,14,44,µg/m_,1 Hr,Valid
Shanghai,PM2.5,2/14/14 15:00,2014,2,14,15,45,µg/m_,1 Hr,Valid
Shanghai,PM2.5,2/14/14 16:00,2014,2,14,16,46,µg/m_,1 Hr,Valid
Shanghai,PM2.5,2/14/14 17:00,2014,2,14,17,47,µg/m_,1 Hr,Valid
Shanghai,PM2.5,2/14/14 18:00,2014,2,14,18,47,µg/m_,1 Hr,Valid
Shanghai,PM2.5,2/14/14 19:00,2014,2,14,19,48,µg/m_,1 Hr,Valid
Shanghai,PM2.5,2/14/14 20:00,2014,2,14,20,52,µg/m_,1 Hr,Valid
Shanghai,PM2.5,2/14/14 21:00,2014,2,14,21,47,µg/m_,1 Hr,Valid
Shanghai,PM2.5,2/14/14 22:00,2014,2,14,22,48,µg/m_,1 Hr,Valid
Shanghai,PM2.5,2/14/14 23:00,2014,2,14,23,41,µg/m_,1 Hr,Valid
Shanghai,PM2.5,2/15/14 00:00,2014,2,15,0,49,µg/m_,1 Hr,Valid
Shanghai,PM2.5,2/15/14 01:00,2014,2,15,1,48,µg/m_,1 Hr,Valid
Shanghai,PM2.5,2/15/14 02:00,2014,2,15,2,29,µg/m_,1 Hr,Valid
Shanghai,PM2.5,2/15/14 03:00,2014,2,15,3,27,µg/m_,1 Hr,Valid
Shanghai,PM2.5,2/15/14 04:00,2014,2,15,4,33,µg/m_,1 Hr,Valid
Shanghai,PM2.5,2/15/14 05:00,2014,2,15,5,21,µg/m_,1 Hr,Valid
Shanghai,PM2.5,2/15/14 06:00,2014,2,15,6,17,µg/m_,1 Hr,Valid
Shanghai,PM2.5,2/15/14 07:00,2014,2,15,7,24,µg/m_,1 Hr,Valid
Shanghai,PM2.5,2/15/14 08:00,2014,2,15,8,19,µg/m_,1 Hr,Valid
Shanghai,PM2.5,2/15/14 09:00,2014,2,15,9,17,µg/m_,1 Hr,Valid
Shanghai,PM2.5,2/15/14 10:00,2014,2,15,10,21,µg/m_,1 Hr,Valid
Shanghai,PM2.5,2/15/14 11:00,2014,2,15,11,17,µg/m_,1 Hr,Valid
Shanghai,PM2.5,2/15/14 12:00,2014,2,15,12,20,µg/m_,1 Hr,Valid
Shanghai,PM2.5,2/15/14 13:00,2014,2,15,13,26,µg/m_,1 Hr,Valid
Shanghai,PM2.5,2/15/14 14:00,2014,2,15,14,27,µg/m_,1 Hr,Valid
Shanghai,PM2.5,2/15/14 15:00,2014,2,15,15,28,µg/m_,1 Hr,Valid
Shanghai,PM2.5,2/15/14 16:00,2014,2,15,16,27,µg/m_,1 Hr,Valid
Shanghai,PM2.5,2/15/14 17:00,2014,2,15,17,31,µg/m_,1 Hr,Valid
Shanghai,PM2.5,2/15/14 18:00,2014,2,15,18,31,µg/m_,1 Hr,Valid
Shanghai,PM2.5,2/15/14 19:00,2014,2,15,19,32,µg/m_,1 Hr,Valid
Shanghai,PM2.5,2/15/14 20:00,2014,2,15,20,32,µg/m_,1 Hr,Valid
Shanghai,PM2.5,2/15/14 21:00,2014,2,15,21,24,µg/m_,1 Hr,Valid
Shanghai,PM2.5,2/15/14 22:00,2014,2,15,22,26,µg/m_,1 Hr,Valid
Shanghai,PM2.5,2/15/14 23:00,2014,2,15,23,30,µg/m_,1 Hr,Valid
Shanghai,PM2.5,2/16/14 00:00,2014,2,16,0,26,µg/m_,1 Hr,Valid
Shanghai,PM2.5,2/16/14 01:00,2014,2,16,1,26,µg/m_,1 Hr,Valid
Shanghai,PM2.5,2/16/14 02:00,2014,2,16,2,21,µg/m_,1 Hr,Valid
Shanghai,PM2.5,2/16/14 03:00,2014,2,16,3,24,µg/m_,1 Hr,Valid
Shanghai,PM2.5,2/16/14 04:00,2014,2,16,4,24,µg/m_,1 Hr,Valid
Shanghai,PM2.5,2/16/14 05:00,2014,2,16,5,22,µg/m_,1 Hr,Valid
Shanghai,PM2.5,2/16/14 06:00,2014,2,16,6,23,µg/m_,1 Hr,Valid
Shanghai,PM2.5,2/16/14 07:00,2014,2,16,7,21,µg/m_,1 Hr,Valid
Shanghai,PM2.5,2/16/14 08:00,2014,2,16,8,27,µg/m_,1 Hr,Valid
Shanghai,PM2.5,2/16/14 09:00,2014,2,16,9,27,µg/m_,1 Hr,Valid
Shanghai,PM2.5,2/16/14 10:00,2014,2,16,10,27,µg/m_,1 Hr,Valid
Shanghai,PM2.5,2/16/14 11:00,2014,2,16,11,27,µg/m_,1 Hr,Valid
Shanghai,PM2.5,2/16/14 12:00,2014,2,16,12,32,µg/m_,1 Hr,Valid
Shanghai,PM2.5,2/16/14 13:00,2014,2,16,13,31,µg/m_,1 Hr,Valid
Shanghai,PM2.5,2/16/14 14:00,2014,2,16,14,28,µg/m_,1 Hr,Valid
Shanghai,PM2.5,2/16/14 15:00,2014,2,16,15,22,µg/m_,1 Hr,Valid
Shanghai,PM2.5,2/16/14 16:00,2014,2,16,16,27,µg/m_,1 Hr,Valid
Shanghai,PM2.5,2/16/14 17:00,2014,2,16,17,23,µg/m_,1 Hr,Valid
Shanghai,PM2.5,2/16/14 18:00,2014,2,16,18,20,µg/m_,1 Hr,Valid
Shanghai,PM2.5,2/16/14 19:00,2014,2,16,19,19,µg/m_,1 Hr,Valid
Shanghai,PM2.5,2/16/14 20:00,2014,2,16,20,18,µg/m_,1 Hr,Valid
Shanghai,PM2.5,2/16/14 21:00,2014,2,16,21,17,µg/m_,1 Hr,Valid
Shanghai,PM2.5,2/16/14 22:00,2014,2,16,22,11,µg/m_,1 Hr,Valid
Shanghai,PM2.5,2/16/14 23:00,2014,2,16,23,15,µg/m_,1 Hr,Valid
Shanghai,PM2.5,2/17/14 00:00,2014,2,17,0,17,µg/m_,1 Hr,Valid
Shanghai,PM2.5,2/17/14 01:00,2014,2,17,1,17,µg/m_,1 Hr,Valid
Shanghai,PM2.5,2/17/14 02:00,2014,2,17,2,23,µg/m_,1 Hr,Valid
Shanghai,PM2.5,2/17/14 03:00,2014,2,17,3,35,µg/m_,1 Hr,Valid
Shanghai,PM2.5,2/17/14 04:00,2014,2,17,4,35,µg/m_,1 Hr,Valid
Shanghai,PM2.5,2/17/14 05:00,2014,2,17,5,38,µg/m_,1 Hr,Valid
Shanghai,PM2.5,2/17/14 06:00,2014,2,17,6,40,µg/m_,1 Hr,Valid
Shanghai,PM2.5,2/17/14 07:00,2014,2,17,7,51,µg/m_,1 Hr,Valid
Shanghai,PM2.5,2/17/14 08:00,2014,2,17,8,60,µg/m_,1 Hr,Valid
Shanghai,PM2.5,2/17/14 09:00,2014,2,17,9,60,µg/m_,1 Hr,Valid
Shanghai,PM2.5,2/17/14 10:00,2014,2,17,10,56,µg/m_,1 Hr,Valid
Shanghai,PM2.5,2/17/14 11:00,2014,2,17,11,54,µg/m_,1 Hr,Valid
Shanghai,PM2.5,2/17/14 12:00,2014,2,17,12,48,µg/m_,1 Hr,Valid
Shanghai,PM2.5,2/17/14 13:00,2014,2,17,13,43,µg/m_,1 Hr,Valid
Shanghai,PM2.5,2/17/14 14:00,2014,2,17,14,30,µg/m_,1 Hr,Valid
Shanghai,PM2.5,2/17/14 15:00,2014,2,17,15,21,µg/m_,1 Hr,Valid
Shanghai,PM2.5,2/17/14 16:00,2014,2,17,16,21,µg/m_,1 Hr,Valid
Shanghai,PM2.5,2/17/14 17:00,2014,2,17,17,19,µg/m_,1 Hr,Valid
Shanghai,PM2.5,2/17/14 18:00,2014,2,17,18,17,µg/m_,1 Hr,Valid
Shanghai,PM2.5,2/17/14 19:00,2014,2,17,19,21,µg/m_,1 Hr,Valid
Shanghai,PM2.5,2/17/14 20:00,2014,2,17,20,16,µg/m_,1 Hr,Valid
Shanghai,PM2.5,2/17/14 21:00,2014,2,17,21,16,µg/m_,1 Hr,Valid
Shanghai,PM2.5,2/17/14 22:00,2014,2,17,22,24,µg/m_,1 Hr,Valid
Shanghai,PM2.5,2/17/14 23:00,2014,2,17,23,33,µg/m_,1 Hr,Valid
Shanghai,PM2.5,2/18/14 00:00,2014,2,18,0,40,µg/m_,1 Hr,Valid
Shanghai,PM2.5,2/18/14 01:00,2014,2,18,1,36,µg/m_,1 Hr,Valid
Shanghai,PM2.5,2/18/14 02:00,2014,2,18,2,37,µg/m_,1 Hr,Valid
Shanghai,PM2.5,2/18/14 03:00,2014,2,18,3,34,µg/m_,1 Hr,Valid
Shanghai,PM2.5,2/18/14 04:00,2014,2,18,4,24,µg/m_,1 Hr,Valid
Shanghai,PM2.5,2/18/14 05:00,2014,2,18,5,23,µg/m_,1 Hr,Valid
Shanghai,PM2.5,2/18/14 06:00,2014,2,18,6,18,µg/m_,1 Hr,Valid
Shanghai,PM2.5,2/18/14 07:00,2014,2,18,7,20,µg/m_,1 Hr,Valid
Shanghai,PM2.5,2/18/14 08:00,2014,2,18,8,20,µg/m_,1 Hr,Valid
Shanghai,PM2.5,2/18/14 09:00,2014,2,18,9,22,µg/m_,1 Hr,Valid
Shanghai,PM2.5,2/18/14 10:00,2014,2,18,10,23,µg/m_,1 Hr,Valid
Shanghai,PM2.5,2/18/14 11:00,2014,2,18,11,16,µg/m_,1 Hr,Valid
Shanghai,PM2.5,2/18/14 12:00,2014,2,18,12,22,µg/m_,1 Hr,Valid
Shanghai,PM2.5,2/18/14 13:00,2014,2,18,13,24,µg/m_,1 Hr,Valid
Shanghai,PM2.5,2/18/14 14:00,2014,2,18,14,24,µg/m_,1 Hr,Valid
Shanghai,PM2.5,2/18/14 15:00,2014,2,18,15,26,µg/m_,1 Hr,Valid
Shanghai,PM2.5,2/18/14 16:00,2014,2,18,16,26,µg/m_,1 Hr,Valid
Shanghai,PM2.5,2/18/14 17:00,2014,2,18,17,32,µg/m_,1 Hr,Valid
Shanghai,PM2.5,2/18/14 18:00,2014,2,18,18,30,µg/m_,1 Hr,Valid
Shanghai,PM2.5,2/18/14 19:00,2014,2,18,19,23,µg/m_,1 Hr,Valid
Shanghai,PM2.5,2/18/14 20:00,2014,2,18,20,27,µg/m_,1 Hr,Valid
Shanghai,PM2.5,2/18/14 21:00,2014,2,18,21,22,µg/m_,1 Hr,Valid
Shanghai,PM2.5,2/18/14 22:00,2014,2,18,22,20,µg/m_,1 Hr,Valid
Shanghai,PM2.5,2/18/14 23:00,2014,2,18,23,25,µg/m_,1 Hr,Valid
Shanghai,PM2.5,2/19/14 00:00,2014,2,19,0,19,µg/m_,1 Hr,Valid
Shanghai,PM2.5,2/19/14 01:00,2014,2,19,1,26,µg/m_,1 Hr,Valid
Shanghai,PM2.5,2/19/14 02:00,2014,2,19,2,31,µg/m_,1 Hr,Valid
Shanghai,PM2.5,2/19/14 03:00,2014,2,19,3,30,µg/m_,1 Hr,Valid
Shanghai,PM2.5,2/19/14 04:00,2014,2,19,4,31,µg/m_,1 Hr,Valid
Shanghai,PM2.5,2/19/14 05:00,2014,2,19,5,33,µg/m_,1 Hr,Valid
Shanghai,PM2.5,2/19/14 06:00,2014,2,19,6,28,µg/m_,1 Hr,Valid
Shanghai,PM2.5,2/19/14 07:00,2014,2,19,7,38,µg/m_,1 Hr,Valid
Shanghai,PM2.5,2/19/14 08:00,2014,2,19,8,48,µg/m_,1 Hr,Valid
Shanghai,PM2.5,2/19/14 09:00,2014,2,19,9,45,µg/m_,1 Hr,Valid
Shanghai,PM2.5,2/19/14 10:00,2014,2,19,10,50,µg/m_,1 Hr,Valid
Shanghai,PM2.5,2/19/14 11:00,2014,2,19,11,-999,µg/m_,1 Hr,Missing
Shanghai,PM2.5,2/19/14 12:00,2014,2,19,12,-999,µg/m_,1 Hr,Missing
Shanghai,PM2.5,2/19/14 13:00,2014,2,19,13,78,µg/m_,1 Hr,Valid
Shanghai,PM2.5,2/19/14 14:00,2014,2,19,14,79,µg/m_,1 Hr,Valid
Shanghai,PM2.5,2/19/14 15:00,2014,2,19,15,67,µg/m_,1 Hr,Valid
Shanghai,PM2.5,2/19/14 16:00,2014,2,19,16,84,µg/m_,1 Hr,Valid
Shanghai,PM2.5,2/19/14 17:00,2014,2,19,17,90,µg/m_,1 Hr,Valid
Shanghai,PM2.5,2/19/14 18:00,2014,2,19,18,92,µg/m_,1 Hr,Valid
Shanghai,PM2.5,2/19/14 19:00,2014,2,19,19,104,µg/m_,1 Hr,Valid
Shanghai,PM2.5,2/19/14 20:00,2014,2,19,20,119,µg/m_,1 Hr,Valid
Shanghai,PM2.5,2/19/14 21:00,2014,2,19,21,133,µg/m_,1 Hr,Valid
Shanghai,PM2.5,2/19/14 22:00,2014,2,19,22,135,µg/m_,1 Hr,Valid
Shanghai,PM2.5,2/19/14 23:00,2014,2,19,23,141,µg/m_,1 Hr,Valid
Shanghai,PM2.5,2/20/14 00:00,2014,2,20,0,138,µg/m_,1 Hr,Valid
Shanghai,PM2.5,2/20/14 01:00,2014,2,20,1,138,µg/m_,1 Hr,Valid
Shanghai,PM2.5,2/20/14 02:00,2014,2,20,2,130,µg/m_,1 Hr,Valid
Shanghai,PM2.5,2/20/14 03:00,2014,2,20,3,129,µg/m_,1 Hr,Valid
Shanghai,PM2.5,2/20/14 04:00,2014,2,20,4,134,µg/m_,1 Hr,Valid
Shanghai,PM2.5,2/20/14 05:00,2014,2,20,5,131,µg/m_,1 Hr,Valid
Shanghai,PM2.5,2/20/14 06:00,2014,2,20,6,137,µg/m_,1 Hr,Valid
Shanghai,PM2.5,2/20/14 07:00,2014,2,20,7,138,µg/m_,1 Hr,Valid
Shanghai,PM2.5,2/20/14 08:00,2014,2,20,8,140,µg/m_,1 Hr,Valid
Shanghai,PM2.5,2/20/14 09:00,2014,2,20,9,151,µg/m_,1 Hr,Valid
Shanghai,PM2.5,2/20/14 10:00,2014,2,20,10,151,µg/m_,1 Hr,Valid
Shanghai,PM2.5,2/20/14 11:00,2014,2,20,11,136,µg/m_,1 Hr,Valid
Shanghai,PM2.5,2/20/14 12:00,2014,2,20,12,146,µg/m_,1 Hr,Valid
Shanghai,PM2.5,2/20/14 13:00,2014,2,20,13,136,µg/m_,1 Hr,Valid
Shanghai,PM2.5,2/20/14 14:00,2014,2,20,14,117,µg/m_,1 Hr,Valid
Shanghai,PM2.5,2/20/14 15:00,2014,2,20,15,121,µg/m_,1 Hr,Valid
Shanghai,PM2.5,2/20/14 16:00,2014,2,20,16,134,µg/m_,1 Hr,Valid
Shanghai,PM2.5,2/20/14 17:00,2014,2,20,17,125,µg/m_,1 Hr,Valid
Shanghai,PM2.5,2/20/14 18:00,2014,2,20,18,102,µg/m_,1 Hr,Valid
Shanghai,PM2.5,2/20/14 19:00,2014,2,20,19,83,µg/m_,1 Hr,Valid
Shanghai,PM2.5,2/20/14 20:00,2014,2,20,20,54,µg/m_,1 Hr,Valid
Shanghai,PM2.5,2/20/14 21:00,2014,2,20,21,56,µg/m_,1 Hr,Valid
Shanghai,PM2.5,2/20/14 22:00,2014,2,20,22,49,µg/m_,1 Hr,Valid
Shanghai,PM2.5,2/20/14 23:00,2014,2,20,23,35,µg/m_,1 Hr,Valid
Shanghai,PM2.5,2/21/14 00:00,2014,2,21,0,39,µg/m_,1 Hr,Valid
Shanghai,PM2.5,2/21/14 01:00,2014,2,21,1,40,µg/m_,1 Hr,Valid
Shanghai,PM2.5,2/21/14 02:00,2014,2,21,2,48,µg/m_,1 Hr,Valid
Shanghai,PM2.5,2/21/14 03:00,2014,2,21,3,53,µg/m_,1 Hr,Valid
Shanghai,PM2.5,2/21/14 04:00,2014,2,21,4,52,µg/m_,1 Hr,Valid
Shanghai,PM2.5,2/21/14 05:00,2014,2,21,5,60,µg/m_,1 Hr,Valid
Shanghai,PM2.5,2/21/14 06:00,2014,2,21,6,63,µg/m_,1 Hr,Valid
Shanghai,PM2.5,2/21/14 07:00,2014,2,21,7,77,µg/m_,1 Hr,Valid
Shanghai,PM2.5,2/21/14 08:00,2014,2,21,8,89,µg/m_,1 Hr,Valid
Shanghai,PM2.5,2/21/14 09:00,2014,2,21,9,105,µg/m_,1 Hr,Valid
Shanghai,PM2.5,2/21/14 10:00,2014,2,21,10,107,µg/m_,1 Hr,Valid
Shanghai,PM2.5,2/21/14 11:00,2014,2,21,11,105,µg/m_,1 Hr,Valid
Shanghai,PM2.5,2/21/14 12:00,2014,2,21,12,101,µg/m_,1 Hr,Valid
Shanghai,PM2.5,2/21/14 13:00,2014,2,21,13,100,µg/m_,1 Hr,Valid
Shanghai,PM2.5,2/21/14 14:00,2014,2,21,14,96,µg/m_,1 Hr,Valid
Shanghai,PM2.5,2/21/14 15:00,2014,2,21,15,95,µg/m_,1 Hr,Valid
Shanghai,PM2.5,2/21/14 16:00,2014,2,21,16,94,µg/m_,1 Hr,Valid
Shanghai,PM2.5,2/21/14 17:00,2014,2,21,17,98,µg/m_,1 Hr,Valid
Shanghai,PM2.5,2/21/14 18:00,2014,2,21,18,101,µg/m_,1 Hr,Valid
Shanghai,PM2.5,2/21/14 19:00,2014,2,21,19,111,µg/m_,1 Hr,Valid
Shanghai,PM2.5,2/21/14 20:00,2014,2,21,20,109,µg/m_,1 Hr,Valid
Shanghai,PM2.5,2/21/14 21:00,2014,2,21,21,107,µg/m_,1 Hr,Valid
Shanghai,PM2.5,2/21/14 22:00,2014,2,21,22,99,µg/m_,1 Hr,Valid
Shanghai,PM2.5,2/21/14 23:00,2014,2,21,23,94,µg/m_,1 Hr,Valid
Shanghai,PM2.5,2/22/14 00:00,2014,2,22,0,87,µg/m_,1 Hr,Valid
Shanghai,PM2.5,2/22/14 01:00,2014,2,22,1,79,µg/m_,1 Hr,Valid
Shanghai,PM2.5,2/22/14 02:00,2014,2,22,2,71,µg/m_,1 Hr,Valid
Shanghai,PM2.5,2/22/14 03:00,2014,2,22,3,64,µg/m_,1 Hr,Valid
Shanghai,PM2.5,2/22/14 04:00,2014,2,22,4,57,µg/m_,1 Hr,Valid
Shanghai,PM2.5,2/22/14 05:00,2014,2,22,5,53,µg/m_,1 Hr,Valid
Shanghai,PM2.5,2/22/14 06:00,2014,2,22,6,56,µg/m_,1 Hr,Valid
Shanghai,PM2.5,2/22/14 07:00,2014,2,22,7,58,µg/m_,1 Hr,Valid
Shanghai,PM2.5,2/22/14 08:00,2014,2,22,8,48,µg/m_,1 Hr,Valid
Shanghai,PM2.5,2/22/14 09:00,2014,2,22,9,53,µg/m_,1 Hr,Valid
Shanghai,PM2.5,2/22/14 10:00,2014,2,22,10,54,µg/m_,1 Hr,Valid
Shanghai,PM2.5,2/22/14 11:00,2014,2,22,11,56,µg/m_,1 Hr,Valid
Shanghai,PM2.5,2/22/14 12:00,2014,2,22,12,59,µg/m_,1 Hr,Valid
Shanghai,PM2.5,2/22/14 13:00,2014,2,22,13,47,µg/m_,1 Hr,Valid
Shanghai,PM2.5,2/22/14 14:00,2014,2,22,14,42,µg/m_,1 Hr,Valid
Shanghai,PM2.5,2/22/14 15:00,2014,2,22,15,41,µg/m_,1 Hr,Valid
Shanghai,PM2.5,2/22/14 16:00,2014,2,22,16,42,µg/m_,1 Hr,Valid
Shanghai,PM2.5,2/22/14 17:00,2014,2,22,17,45,µg/m_,1 Hr,Valid
Shanghai,PM2.5,2/22/14 18:00,2014,2,22,18,45,µg/m_,1 Hr,Valid
Shanghai,PM2.5,2/22/14 19:00,2014,2,22,19,48,µg/m_,1 Hr,Valid
Shanghai,PM2.5,2/22/14 20:00,2014,2,22,20,42,µg/m_,1 Hr,Valid
Shanghai,PM2.5,2/22/14 21:00,2014,2,22,21,47,µg/m_,1 Hr,Valid
Shanghai,PM2.5,2/22/14 22:00,2014,2,22,22,56,µg/m_,1 Hr,Valid
Shanghai,PM2.5,2/22/14 23:00,2014,2,22,23,60,µg/m_,1 Hr,Valid
Shanghai,PM2.5,2/23/14 00:00,2014,2,23,0,65,µg/m_,1 Hr,Valid
Shanghai,PM2.5,2/23/14 01:00,2014,2,23,1,65,µg/m_,1 Hr,Valid
Shanghai,PM2.5,2/23/14 02:00,2014,2,23,2,66,µg/m_,1 Hr,Valid
Shanghai,PM2.5,2/23/14 03:00,2014,2,23,3,67,µg/m_,1 Hr,Valid
Shanghai,PM2.5,2/23/14 04:00,2014,2,23,4,66,µg/m_,1 Hr,Valid
Shanghai,PM2.5,2/23/14 05:00,2014,2,23,5,76,µg/m_,1 Hr,Valid
Shanghai,PM2.5,2/23/14 06:00,2014,2,23,6,87,µg/m_,1 Hr,Valid
Shanghai,PM2.5,2/23/14 07:00,2014,2,23,7,91,µg/m_,1 Hr,Valid
Shanghai,PM2.5,2/23/14 08:00,2014,2,23,8,90,µg/m_,1 Hr,Valid
Shanghai,PM2.5,2/23/14 09:00,2014,2,23,9,97,µg/m_,1 Hr,Valid
Shanghai,PM2.5,2/23/14 10:00,2014,2,23,10,89,µg/m_,1 Hr,Valid
Shanghai,PM2.5,2/23/14 11:00,2014,2,23,11,86,µg/m_,1 Hr,Valid
Shanghai,PM2.5,2/23/14 12:00,2014,2,23,12,79,µg/m_,1 Hr,Valid
Shanghai,PM2.5,2/23/14 13:00,2014,2,23,13,83,µg/m_,1 Hr,Valid
Shanghai,PM2.5,2/23/14 14:00,2014,2,23,14,70,µg/m_,1 Hr,Valid
Shanghai,PM2.5,2/23/14 15:00,2014,2,23,15,67,µg/m_,1 Hr,Valid
Shanghai,PM2.5,2/23/14 16:00,2014,2,23,16,77,µg/m_,1 Hr,Valid
Shanghai,PM2.5,2/23/14 17:00,2014,2,23,17,86,µg/m_,1 Hr,Valid
Shanghai,PM2.5,2/23/14 18:00,2014,2,23,18,84,µg/m_,1 Hr,Valid
Shanghai,PM2.5,2/23/14 19:00,2014,2,23,19,95,µg/m_,1 Hr,Valid
Shanghai,PM2.5,2/23/14 20:00,2014,2,23,20,90,µg/m_,1 Hr,Valid
Shanghai,PM2.5,2/23/14 21:00,2014,2,23,21,98,µg/m_,1 Hr,Valid
Shanghai,PM2.5,2/23/14 22:00,2014,2,23,22,97,µg/m_,1 Hr,Valid
Shanghai,PM2.5,2/23/14 23:00,2014,2,23,23,106,µg/m_,1 Hr,Valid
Shanghai,PM2.5,2/24/14 00:00,2014,2,24,0,100,µg/m_,1 Hr,Valid
Shanghai,PM2.5,2/24/14 01:00,2014,2,24,1,98,µg/m_,1 Hr,Valid
Shanghai,PM2.5,2/24/14 02:00,2014,2,24,2,99,µg/m_,1 Hr,Valid
Shanghai,PM2.5,2/24/14 03:00,2014,2,24,3,101,µg/m_,1 Hr,Valid
Shanghai,PM2.5,2/24/14 04:00,2014,2,24,4,97,µg/m_,1 Hr,Valid
Shanghai,PM2.5,2/24/14 05:00,2014,2,24,5,100,µg/m_,1 Hr,Valid
Shanghai,PM2.5,2/24/14 06:00,2014,2,24,6,101,µg/m_,1 Hr,Valid
Shanghai,PM2.5,2/24/14 07:00,2014,2,24,7,97,µg/m_,1 Hr,Valid
Shanghai,PM2.5,2/24/14 08:00,2014,2,24,8,99,µg/m_,1 Hr,Valid
Shanghai,PM2.5,2/24/14 09:00,2014,2,24,9,90,µg/m_,1 Hr,Valid
Shanghai,PM2.5,2/24/14 10:00,2014,2,24,10,91,µg/m_,1 Hr,Valid
Shanghai,PM2.5,2/24/14 11:00,2014,2,24,11,80,µg/m_,1 Hr,Valid
Shanghai,PM2.5,2/24/14 12:00,2014,2,24,12,69,µg/m_,1 Hr,Valid
Shanghai,PM2.5,2/24/14 13:00,2014,2,24,13,60,µg/m_,1 Hr,Valid
Shanghai,PM2.5,2/24/14 14:00,2014,2,24,14,39,µg/m_,1 Hr,Valid
Shanghai,PM2.5,2/24/14 15:00,2014,2,24,15,40,µg/m_,1 Hr,Valid
Shanghai,PM2.5,2/24/14 16:00,2014,2,24,16,43,µg/m_,1 Hr,Valid
Shanghai,PM2.5,2/24/14 17:00,2014,2,24,17,57,µg/m_,1 Hr,Valid
Shanghai,PM2.5,2/24/14 18:00,2014,2,24,18,68,µg/m_,1 Hr,Valid
Shanghai,PM2.5,2/24/14 19:00,2014,2,24,19,69,µg/m_,1 Hr,Valid
Shanghai,PM2.5,2/24/14 20:00,2014,2,24,20,64,µg/m_,1 Hr,Valid
Shanghai,PM2.5,2/24/14 21:00,2014,2,24,21,54,µg/m_,1 Hr,Valid
Shanghai,PM2.5,2/24/14 22:00,2014,2,24,22,48,µg/m_,1 Hr,Valid
Shanghai,PM2.5,2/24/14 23:00,2014,2,24,23,44,µg/m_,1 Hr,Valid
Shanghai,PM2.5,2/25/14 00:00,2014,2,25,0,42,µg/m_,1 Hr,Valid
Shanghai,PM2.5,2/25/14 01:00,2014,2,25,1,36,µg/m_,1 Hr,Valid
Shanghai,PM2.5,2/25/14 02:00,2014,2,25,2,34,µg/m_,1 Hr,Valid
Shanghai,PM2.5,2/25/14 03:00,2014,2,25,3,29,µg/m_,1 Hr,Valid
Shanghai,PM2.5,2/25/14 04:00,2014,2,25,4,33,µg/m_,1 Hr,Valid
Shanghai,PM2.5,2/25/14 05:00,2014,2,25,5,21,µg/m_,1 Hr,Valid
Shanghai,PM2.5,2/25/14 06:00,2014,2,25,6,26,µg/m_,1 Hr,Valid
Shanghai,PM2.5,2/25/14 07:00,2014,2,25,7,27,µg/m_,1 Hr,Valid
Shanghai,PM2.5,2/25/14 08:00,2014,2,25,8,21,µg/m_,1 Hr,Valid
Shanghai,PM2.5,2/25/14 09:00,2014,2,25,9,22,µg/m_,1 Hr,Valid
Shanghai,PM2.5,2/25/14 10:00,2014,2,25,10,17,µg/m_,1 Hr,Valid
Shanghai,PM2.5,2/25/14 11:00,2014,2,25,11,18,µg/m_,1 Hr,Valid
Shanghai,PM2.5,2/25/14 12:00,2014,2,25,12,16,µg/m_,1 Hr,Valid
Shanghai,PM2.5,2/25/14 13:00,2014,2,25,13,14,µg/m_,1 Hr,Valid
Shanghai,PM2.5,2/25/14 14:00,2014,2,25,14,16,µg/m_,1 Hr,Valid
Shanghai,PM2.5,2/25/14 15:00,2014,2,25,15,17,µg/m_,1 Hr,Valid
Shanghai,PM2.5,2/25/14 16:00,2014,2,25,16,15,µg/m_,1 Hr,Valid
Shanghai,PM2.5,2/25/14 17:00,2014,2,25,17,12,µg/m_,1 Hr,Valid
Shanghai,PM2.5,2/25/14 18:00,2014,2,25,18,18,µg/m_,1 Hr,Valid
Shanghai,PM2.5,2/25/14 19:00,2014,2,25,19,15,µg/m_,1 Hr,Valid
Shanghai,PM2.5,2/25/14 20:00,2014,2,25,20,23,µg/m_,1 Hr,Valid
Shanghai,PM2.5,2/25/14 21:00,2014,2,25,21,14,µg/m_,1 Hr,Valid
Shanghai,PM2.5,2/25/14 22:00,2014,2,25,22,19,µg/m_,1 Hr,Valid
Shanghai,PM2.5,2/25/14 23:00,2014,2,25,23,21,µg/m_,1 Hr,Valid
Shanghai,PM2.5,2/26/14 00:00,2014,2,26,0,17,µg/m_,1 Hr,Valid
Shanghai,PM2.5,2/26/14 01:00,2014,2,26,1,23,µg/m_,1 Hr,Valid
Shanghai,PM2.5,2/26/14 02:00,2014,2,26,2,33,µg/m_,1 Hr,Valid
Shanghai,PM2.5,2/26/14 03:00,2014,2,26,3,29,µg/m_,1 Hr,Valid
Shanghai,PM2.5,2/26/14 04:00,2014,2,26,4,28,µg/m_,1 Hr,Valid
Shanghai,PM2.5,2/26/14 05:00,2014,2,26,5,20,µg/m_,1 Hr,Valid
Shanghai,PM2.5,2/26/14 06:00,2014,2,26,6,27,µg/m_,1 Hr,Valid
Shanghai,PM2.5,2/26/14 07:00,2014,2,26,7,25,µg/m_,1 Hr,Valid
Shanghai,PM2.5,2/26/14 08:00,2014,2,26,8,22,µg/m_,1 Hr,Valid
Shanghai,PM2.5,2/26/14 09:00,2014,2,26,9,25,µg/m_,1 Hr,Valid
Shanghai,PM2.5,2/26/14 10:00,2014,2,26,10,36,µg/m_,1 Hr,Valid
Shanghai,PM2.5,2/26/14 11:00,2014,2,26,11,44,µg/m_,1 Hr,Valid
Shanghai,PM2.5,2/26/14 12:00,2014,2,26,12,42,µg/m_,1 Hr,Valid
Shanghai,PM2.5,2/26/14 13:00,2014,2,26,13,41,µg/m_,1 Hr,Valid
Shanghai,PM2.5,2/26/14 14:00,2014,2,26,14,67,µg/m_,1 Hr,Valid
Shanghai,PM2.5,2/26/14 15:00,2014,2,26,15,68,µg/m_,1 Hr,Valid
Shanghai,PM2.5,2/26/14 16:00,2014,2,26,16,77,µg/m_,1 Hr,Valid
Shanghai,PM2.5,2/26/14 17:00,2014,2,26,17,83,µg/m_,1 Hr,Valid
Shanghai,PM2.5,2/26/14 18:00,2014,2,26,18,102,µg/m_,1 Hr,Valid
Shanghai,PM2.5,2/26/14 19:00,2014,2,26,19,113,µg/m_,1 Hr,Valid
Shanghai,PM2.5,2/26/14 20:00,2014,2,26,20,83,µg/m_,1 Hr,Valid
Shanghai,PM2.5,2/26/14 21:00,2014,2,26,21,97,µg/m_,1 Hr,Valid
Shanghai,PM2.5,2/26/14 22:00,2014,2,26,22,97,µg/m_,1 Hr,Valid
Shanghai,PM2.5,2/26/14 23:00,2014,2,26,23,91,µg/m_,1 Hr,Valid
Shanghai,PM2.5,2/27/14 00:00,2014,2,27,0,95,µg/m_,1 Hr,Valid
Shanghai,PM2.5,2/27/14 01:00,2014,2,27,1,106,µg/m_,1 Hr,Valid
Shanghai,PM2.5,2/27/14 02:00,2014,2,27,2,105,µg/m_,1 Hr,Valid
Shanghai,PM2.5,2/27/14 03:00,2014,2,27,3,89,µg/m_,1 Hr,Valid
Shanghai,PM2.5,2/27/14 04:00,2014,2,27,4,90,µg/m_,1 Hr,Valid
Shanghai,PM2.5,2/27/14 05:00,2014,2,27,5,93,µg/m_,1 Hr,Valid
Shanghai,PM2.5,2/27/14 06:00,2014,2,27,6,82,µg/m_,1 Hr,Valid
Shanghai,PM2.5,2/27/14 07:00,2014,2,27,7,90,µg/m_,1 Hr,Valid
Shanghai,PM2.5,2/27/14 08:00,2014,2,27,8,100,µg/m_,1 Hr,Valid
Shanghai,PM2.5,2/27/14 09:00,2014,2,27,9,89,µg/m_,1 Hr,Valid
Shanghai,PM2.5,2/27/14 10:00,2014,2,27,10,104,µg/m_,1 Hr,Valid
Shanghai,PM2.5,2/27/14 11:00,2014,2,27,11,80,µg/m_,1 Hr,Valid
Shanghai,PM2.5,2/27/14 12:00,2014,2,27,12,83,µg/m_,1 Hr,Valid
Shanghai,PM2.5,2/27/14 13:00,2014,2,27,13,92,µg/m_,1 Hr,Valid
Shanghai,PM2.5,2/27/14 14:00,2014,2,27,14,123,µg/m_,1 Hr,Valid
Shanghai,PM2.5,2/27/14 15:00,2014,2,27,15,91,µg/m_,1 Hr,Valid
Shanghai,PM2.5,2/27/14 16:00,2014,2,27,16,96,µg/m_,1 Hr,Valid
Shanghai,PM2.5,2/27/14 17:00,2014,2,27,17,78,µg/m_,1 Hr,Valid
Shanghai,PM2.5,2/27/14 18:00,2014,2,27,18,91,µg/m_,1 Hr,Valid
Shanghai,PM2.5,2/27/14 19:00,2014,2,27,19,72,µg/m_,1 Hr,Valid
Shanghai,PM2.5,2/27/14 20:00,2014,2,27,20,58,µg/m_,1 Hr,Valid
Shanghai,PM2.5,2/27/14 21:00,2014,2,27,21,42,µg/m_,1 Hr,Valid
Shanghai,PM2.5,2/27/14 22:00,2014,2,27,22,64,µg/m_,1 Hr,Valid
Shanghai,PM2.5,2/27/14 23:00,2014,2,27,23,76,µg/m_,1 Hr,Valid
Shanghai,PM2.5,2/28/14 00:00,2014,2,28,0,79,µg/m_,1 Hr,Valid
Shanghai,PM2.5,2/28/14 01:00,2014,2,28,1,91,µg/m_,1 Hr,Valid
Shanghai,PM2.5,2/28/14 02:00,2014,2,28,2,97,µg/m_,1 Hr,Valid
Shanghai,PM2.5,2/28/14 03:00,2014,2,28,3,108,µg/m_,1 Hr,Valid
Shanghai,PM2.5,2/28/14 04:00,2014,2,28,4,122,µg/m_,1 Hr,Valid
Shanghai,PM2.5,2/28/14 05:00,2014,2,28,5,94,µg/m_,1 Hr,Valid
Shanghai,PM2.5,2/28/14 06:00,2014,2,28,6,70,µg/m_,1 Hr,Valid
Shanghai,PM2.5,2/28/14 07:00,2014,2,28,7,63,µg/m_,1 Hr,Valid
Shanghai,PM2.5,2/28/14 08:00,2014,2,28,8,57,µg/m_,1 Hr,Valid
Shanghai,PM2.5,2/28/14 09:00,2014,2,28,9,54,µg/m_,1 Hr,Valid
Shanghai,PM2.5,2/28/14 10:00,2014,2,28,10,69,µg/m_,1 Hr,Valid
Shanghai,PM2.5,2/28/14 11:00,2014,2,28,11,76,µg/m_,1 Hr,Valid
Shanghai,PM2.5,2/28/14 12:00,2014,2,28,12,89,µg/m_,1 Hr,Valid
Shanghai,PM2.5,2/28/14 13:00,2014,2,28,13,95,µg/m_,1 Hr,Valid
Shanghai,PM2.5,2/28/14 14:00,2014,2,28,14,105,µg/m_,1 Hr,Valid
Shanghai,PM2.5,2/28/14 15:00,2014,2,28,15,121,µg/m_,1 Hr,Valid
Shanghai,PM2.5,2/28/14 16:00,2014,2,28,16,112,µg/m_,1 Hr,Valid
Shanghai,PM2.5,2/28/14 17:00,2014,2,28,17,96,µg/m_,1 Hr,Valid
Shanghai,PM2.5,2/28/14 18:00,2014,2,28,18,74,µg/m_,1 Hr,Valid
Shanghai,PM2.5,2/28/14 19:00,2014,2,28,19,64,µg/m_,1 Hr,Valid
Shanghai,PM2.5,2/28/14 20:00,2014,2,28,20,48,µg/m_,1 Hr,Valid
Shanghai,PM2.5,2/28/14 21:00,2014,2,28,21,38,µg/m_,1 Hr,Valid
Shanghai,PM2.5,2/28/14 22:00,2014,2,28,22,30,µg/m_,1 Hr,Valid
Shanghai,PM2.5,2/28/14 23:00,2014,2,28,23,43,µg/m_,1 Hr,Valid
Shanghai,PM2.5,3/1/14 00:00,2014,3,1,0,42,µg/m_,1 Hr,Valid
Shanghai,PM2.5,3/1/14 01:00,2014,3,1,1,38,µg/m_,1 Hr,Valid
Shanghai,PM2.5,3/1/14 02:00,2014,3,1,2,25,µg/m_,1 Hr,Valid
Shanghai,PM2.5,3/1/14 03:00,2014,3,1,3,26,µg/m_,1 Hr,Valid
Shanghai,PM2.5,3/1/14 04:00,2014,3,1,4,26,µg/m_,1 Hr,Valid
Shanghai,PM2.5,3/1/14 05:00,2014,3,1,5,18,µg/m_,1 Hr,Valid
Shanghai,PM2.5,3/1/14 06:00,2014,3,1,6,15,µg/m_,1 Hr,Valid
Shanghai,PM2.5,3/1/14 07:00,2014,3,1,7,21,µg/m_,1 Hr,Valid
Shanghai,PM2.5,3/1/14 08:00,2014,3,1,8,22,µg/m_,1 Hr,Valid
Shanghai,PM2.5,3/1/14 09:00,2014,3,1,9,29,µg/m_,1 Hr,Valid
Shanghai,PM2.5,3/1/14 10:00,2014,3,1,10,26,µg/m_,1 Hr,Valid
Shanghai,PM2.5,3/1/14 11:00,2014,3,1,11,25,µg/m_,1 Hr,Valid
Shanghai,PM2.5,3/1/14 12:00,2014,3,1,12,29,µg/m_,1 Hr,Valid
Shanghai,PM2.5,3/1/14 13:00,2014,3,1,13,34,µg/m_,1 Hr,Valid
Shanghai,PM2.5,3/1/14 14:00,2014,3,1,14,34,µg/m_,1 Hr,Valid
Shanghai,PM2.5,3/1/14 15:00,2014,3,1,15,31,µg/m_,1 Hr,Valid
Shanghai,PM2.5,3/1/14 16:00,2014,3,1,16,25,µg/m_,1 Hr,Valid
Shanghai,PM2.5,3/1/14 17:00,2014,3,1,17,36,µg/m_,1 Hr,Valid
Shanghai,PM2.5,3/1/14 18:00,2014,3,1,18,35,µg/m_,1 Hr,Valid
Shanghai,PM2.5,3/1/14 19:00,2014,3,1,19,34,µg/m_,1 Hr,Valid
Shanghai,PM2.5,3/1/14 20:00,2014,3,1,20,32,µg/m_,1 Hr,Valid
Shanghai,PM2.5,3/1/14 21:00,2014,3,1,21,35,µg/m_,1 Hr,Valid
Shanghai,PM2.5,3/1/14 22:00,2014,3,1,22,37,µg/m_,1 Hr,Valid
Shanghai,PM2.5,3/1/14 23:00,2014,3,1,23,43,µg/m_,1 Hr,Valid
Shanghai,PM2.5,3/2/14 00:00,2014,3,2,0,42,µg/m_,1 Hr,Valid
Shanghai,PM2.5,3/2/14 01:00,2014,3,2,1,44,µg/m_,1 Hr,Valid
Shanghai,PM2.5,3/2/14 02:00,2014,3,2,2,30,µg/m_,1 Hr,Valid
Shanghai,PM2.5,3/2/14 03:00,2014,3,2,3,26,µg/m_,1 Hr,Valid
Shanghai,PM2.5,3/2/14 04:00,2014,3,2,4,31,µg/m_,1 Hr,Valid
Shanghai,PM2.5,3/2/14 05:00,2014,3,2,5,33,µg/m_,1 Hr,Valid
Shanghai,PM2.5,3/2/14 06:00,2014,3,2,6,40,µg/m_,1 Hr,Valid
Shanghai,PM2.5,3/2/14 07:00,2014,3,2,7,47,µg/m_,1 Hr,Valid
Shanghai,PM2.5,3/2/14 08:00,2014,3,2,8,57,µg/m_,1 Hr,Valid
Shanghai,PM2.5,3/2/14 09:00,2014,3,2,9,62,µg/m_,1 Hr,Valid
Shanghai,PM2.5,3/2/14 10:00,2014,3,2,10,72,µg/m_,1 Hr,Valid
Shanghai,PM2.5,3/2/14 11:00,2014,3,2,11,64,µg/m_,1 Hr,Valid
Shanghai,PM2.5,3/2/14 12:00,2014,3,2,12,70,µg/m_,1 Hr,Valid
Shanghai,PM2.5,3/2/14 13:00,2014,3,2,13,81,µg/m_,1 Hr,Valid
Shanghai,PM2.5,3/2/14 14:00,2014,3,2,14,58,µg/m_,1 Hr,Valid
Shanghai,PM2.5,3/2/14 15:00,2014,3,2,15,60,µg/m_,1 Hr,Valid
Shanghai,PM2.5,3/2/14 16:00,2014,3,2,16,65,µg/m_,1 Hr,Valid
Shanghai,PM2.5,3/2/14 17:00,2014,3,2,17,64,µg/m_,1 Hr,Valid
Shanghai,PM2.5,3/2/14 18:00,2014,3,2,18,56,µg/m_,1 Hr,Valid
Shanghai,PM2.5,3/2/14 19:00,2014,3,2,19,55,µg/m_,1 Hr,Valid
Shanghai,PM2.5,3/2/14 20:00,2014,3,2,20,53,µg/m_,1 Hr,Valid
Shanghai,PM2.5,3/2/14 21:00,2014,3,2,21,50,µg/m_,1 Hr,Valid
Shanghai,PM2.5,3/2/14 22:00,2014,3,2,22,52,µg/m_,1 Hr,Valid
Shanghai,PM2.5,3/2/14 23:00,2014,3,2,23,55,µg/m_,1 Hr,Valid
Shanghai,PM2.5,3/3/14 00:00,2014,3,3,0,52,µg/m_,1 Hr,Valid
Shanghai,PM2.5,3/3/14 01:00,2014,3,3,1,52,µg/m_,1 Hr,Valid
Shanghai,PM2.5,3/3/14 02:00,2014,3,3,2,60,µg/m_,1 Hr,Valid
Shanghai,PM2.5,3/3/14 03:00,2014,3,3,3,57,µg/m_,1 Hr,Valid
Shanghai,PM2.5,3/3/14 04:00,2014,3,3,4,53,µg/m_,1 Hr,Valid
Shanghai,PM2.5,3/3/14 05:00,2014,3,3,5,43,µg/m_,1 Hr,Valid
Shanghai,PM2.5,3/3/14 06:00,2014,3,3,6,39,µg/m_,1 Hr,Valid
Shanghai,PM2.5,3/3/14 07:00,2014,3,3,7,31,µg/m_,1 Hr,Valid
Shanghai,PM2.5,3/3/14 08:00,2014,3,3,8,30,µg/m_,1 Hr,Valid
Shanghai,PM2.5,3/3/14 09:00,2014,3,3,9,26,µg/m_,1 Hr,Valid
Shanghai,PM2.5,3/3/14 10:00,2014,3,3,10,21,µg/m_,1 Hr,Valid
Shanghai,PM2.5,3/3/14 11:00,2014,3,3,11,25,µg/m_,1 Hr,Valid
Shanghai,PM2.5,3/3/14 12:00,2014,3,3,12,21,µg/m_,1 Hr,Valid
Shanghai,PM2.5,3/3/14 13:00,2014,3,3,13,24,µg/m_,1 Hr,Valid
Shanghai,PM2.5,3/3/14 14:00,2014,3,3,14,22,µg/m_,1 Hr,Valid
Shanghai,PM2.5,3/3/14 15:00,2014,3,3,15,22,µg/m_,1 Hr,Valid
Shanghai,PM2.5,3/3/14 16:00,2014,3,3,16,31,µg/m_,1 Hr,Valid
Shanghai,PM2.5,3/3/14 17:00,2014,3,3,17,27,µg/m_,1 Hr,Valid
Shanghai,PM2.5,3/3/14 18:00,2014,3,3,18,31,µg/m_,1 Hr,Valid
Shanghai,PM2.5,3/3/14 19:00,2014,3,3,19,27,µg/m_,1 Hr,Valid
Shanghai,PM2.5,3/3/14 20:00,2014,3,3,20,28,µg/m_,1 Hr,Valid
Shanghai,PM2.5,3/3/14 21:00,2014,3,3,21,28,µg/m_,1 Hr,Valid
Shanghai,PM2.5,3/3/14 22:00,2014,3,3,22,29,µg/m_,1 Hr,Valid
Shanghai,PM2.5,3/3/14 23:00,2014,3,3,23,27,µg/m_,1 Hr,Valid
Shanghai,PM2.5,3/4/14 00:00,2014,3,4,0,30,µg/m_,1 Hr,Valid
Shanghai,PM2.5,3/4/14 01:00,2014,3,4,1,21,µg/m_,1 Hr,Valid
Shanghai,PM2.5,3/4/14 02:00,2014,3,4,2,33,µg/m_,1 Hr,Valid
Shanghai,PM2.5,3/4/14 03:00,2014,3,4,3,26,µg/m_,1 Hr,Valid
Shanghai,PM2.5,3/4/14 04:00,2014,3,4,4,24,µg/m_,1 Hr,Valid
Shanghai,PM2.5,3/4/14 05:00,2014,3,4,5,22,µg/m_,1 Hr,Valid
Shanghai,PM2.5,3/4/14 06:00,2014,3,4,6,18,µg/m_,1 Hr,Valid
Shanghai,PM2.5,3/4/14 07:00,2014,3,4,7,21,µg/m_,1 Hr,Valid
Shanghai,PM2.5,3/4/14 08:00,2014,3,4,8,20,µg/m_,1 Hr,Valid
Shanghai,PM2.5,3/4/14 09:00,2014,3,4,9,26,µg/m_,1 Hr,Valid
Shanghai,PM2.5,3/4/14 10:00,2014,3,4,10,-999,µg/m_,1 Hr,Missing
Shanghai,PM2.5,3/4/14 11:00,2014,3,4,11,22,µg/m_,1 Hr,Valid
Shanghai,PM2.5,3/4/14 12:00,2014,3,4,12,20,µg/m_,1 Hr,Valid
Shanghai,PM2.5,3/4/14 13:00,2014,3,4,13,28,µg/m_,1 Hr,Valid
Shanghai,PM2.5,3/4/14 14:00,2014,3,4,14,26,µg/m_,1 Hr,Valid
Shanghai,PM2.5,3/4/14 15:00,2014,3,4,15,27,µg/m_,1 Hr,Valid
Shanghai,PM2.5,3/4/14 16:00,2014,3,4,16,28,µg/m_,1 Hr,Valid
Shanghai,PM2.5,3/4/14 17:00,2014,3,4,17,26,µg/m_,1 Hr,Valid
Shanghai,PM2.5,3/4/14 18:00,2014,3,4,18,39,µg/m_,1 Hr,Valid
Shanghai,PM2.5,3/4/14 19:00,2014,3,4,19,33,µg/m_,1 Hr,Valid
Shanghai,PM2.5,3/4/14 20:00,2014,3,4,20,34,µg/m_,1 Hr,Valid
Shanghai,PM2.5,3/4/14 21:00,2014,3,4,21,27,µg/m_,1 Hr,Valid
Shanghai,PM2.5,3/4/14 22:00,2014,3,4,22,24,µg/m_,1 Hr,Valid
Shanghai,PM2.5,3/4/14 23:00,2014,3,4,23,25,µg/m_,1 Hr,Valid
Shanghai,PM2.5,3/5/14 00:00,2014,3,5,0,19,µg/m_,1 Hr,Valid
Shanghai,PM2.5,3/5/14 01:00,2014,3,5,1,26,µg/m_,1 Hr,Valid
Shanghai,PM2.5,3/5/14 02:00,2014,3,5,2,30,µg/m_,1 Hr,Valid
Shanghai,PM2.5,3/5/14 03:00,2014,3,5,3,29,µg/m_,1 Hr,Valid
Shanghai,PM2.5,3/5/14 04:00,2014,3,5,4,46,µg/m_,1 Hr,Valid
Shanghai,PM2.5,3/5/14 05:00,2014,3,5,5,58,µg/m_,1 Hr,Valid
Shanghai,PM2.5,3/5/14 06:00,2014,3,5,6,54,µg/m_,1 Hr,Valid
Shanghai,PM2.5,3/5/14 07:00,2014,3,5,7,63,µg/m_,1 Hr,Valid
Shanghai,PM2.5,3/5/14 08:00,2014,3,5,8,76,µg/m_,1 Hr,Valid
Shanghai,PM2.5,3/5/14 09:00,2014,3,5,9,93,µg/m_,1 Hr,Valid
Shanghai,PM2.5,3/5/14 10:00,2014,3,5,10,59,µg/m_,1 Hr,Valid
Shanghai,PM2.5,3/5/14 11:00,2014,3,5,11,44,µg/m_,1 Hr,Valid
Shanghai,PM2.5,3/5/14 12:00,2014,3,5,12,37,µg/m_,1 Hr,Valid
Shanghai,PM2.5,3/5/14 13:00,2014,3,5,13,38,µg/m_,1 Hr,Valid
Shanghai,PM2.5,3/5/14 14:00,2014,3,5,14,38,µg/m_,1 Hr,Valid
Shanghai,PM2.5,3/5/14 15:00,2014,3,5,15,35,µg/m_,1 Hr,Valid
Shanghai,PM2.5,3/5/14 16:00,2014,3,5,16,34,µg/m_,1 Hr,Valid
Shanghai,PM2.5,3/5/14 17:00,2014,3,5,17,27,µg/m_,1 Hr,Valid
Shanghai,PM2.5,3/5/14 18:00,2014,3,5,18,27,µg/m_,1 Hr,Valid
Shanghai,PM2.5,3/5/14 19:00,2014,3,5,19,29,µg/m_,1 Hr,Valid
Shanghai,PM2.5,3/5/14 20:00,2014,3,5,20,30,µg/m_,1 Hr,Valid
Shanghai,PM2.5,3/5/14 21:00,2014,3,5,21,23,µg/m_,1 Hr,Valid
Shanghai,PM2.5,3/5/14 22:00,2014,3,5,22,25,µg/m_,1 Hr,Valid
Shanghai,PM2.5,3/5/14 23:00,2014,3,5,23,18,µg/m_,1 Hr,Valid
Shanghai,PM2.5,3/6/14 00:00,2014,3,6,0,21,µg/m_,1 Hr,Valid
Shanghai,PM2.5,3/6/14 01:00,2014,3,6,1,24,µg/m_,1 Hr,Valid
Shanghai,PM2.5,3/6/14 02:00,2014,3,6,2,17,µg/m_,1 Hr,Valid
Shanghai,PM2.5,3/6/14 03:00,2014,3,6,3,18,µg/m_,1 Hr,Valid
Shanghai,PM2.5,3/6/14 04:00,2014,3,6,4,19,µg/m_,1 Hr,Valid
Shanghai,PM2.5,3/6/14 05:00,2014,3,6,5,25,µg/m_,1 Hr,Valid
Shanghai,PM2.5,3/6/14 06:00,2014,3,6,6,29,µg/m_,1 Hr,Valid
Shanghai,PM2.5,3/6/14 07:00,2014,3,6,7,29,µg/m_,1 Hr,Valid
Shanghai,PM2.5,3/6/14 08:00,2014,3,6,8,31,µg/m_,1 Hr,Valid
Shanghai,PM2.5,3/6/14 09:00,2014,3,6,9,30,µg/m_,1 Hr,Valid
Shanghai,PM2.5,3/6/14 10:00,2014,3,6,10,27,µg/m_,1 Hr,Valid
Shanghai,PM2.5,3/6/14 11:00,2014,3,6,11,25,µg/m_,1 Hr,Valid
Shanghai,PM2.5,3/6/14 12:00,2014,3,6,12,20,µg/m_,1 Hr,Valid
Shanghai,PM2.5,3/6/14 13:00,2014,3,6,13,19,µg/m_,1 Hr,Valid
Shanghai,PM2.5,3/6/14 14:00,2014,3,6,14,20,µg/m_,1 Hr,Valid
Shanghai,PM2.5,3/6/14 15:00,2014,3,6,15,18,µg/m_,1 Hr,Valid
Shanghai,PM2.5,3/6/14 16:00,2014,3,6,16,23,µg/m_,1 Hr,Valid
Shanghai,PM2.5,3/6/14 17:00,2014,3,6,17,19,µg/m_,1 Hr,Valid
Shanghai,PM2.5,3/6/14 18:00,2014,3,6,18,24,µg/m_,1 Hr,Valid
Shanghai,PM2.5,3/6/14 19:00,2014,3,6,19,23,µg/m_,1 Hr,Valid
Shanghai,PM2.5,3/6/14 20:00,2014,3,6,20,25,µg/m_,1 Hr,Valid
Shanghai,PM2.5,3/6/14 21:00,2014,3,6,21,25,µg/m_,1 Hr,Valid
Shanghai,PM2.5,3/6/14 22:00,2014,3,6,22,23,µg/m_,1 Hr,Valid
Shanghai,PM2.5,3/6/14 23:00,2014,3,6,23,20,µg/m_,1 Hr,Valid
Shanghai,PM2.5,3/7/14 00:00,2014,3,7,0,25,µg/m_,1 Hr,Valid
Shanghai,PM2.5,3/7/14 01:00,2014,3,7,1,29,µg/m_,1 Hr,Valid
Shanghai,PM2.5,3/7/14 02:00,2014,3,7,2,30,µg/m_,1 Hr,Valid
Shanghai,PM2.5,3/7/14 03:00,2014,3,7,3,18,µg/m_,1 Hr,Valid
Shanghai,PM2.5,3/7/14 04:00,2014,3,7,4,17,µg/m_,1 Hr,Valid
Shanghai,PM2.5,3/7/14 05:00,2014,3,7,5,19,µg/m_,1 Hr,Valid
Shanghai,PM2.5,3/7/14 06:00,2014,3,7,6,22,µg/m_,1 Hr,Valid
Shanghai,PM2.5,3/7/14 07:00,2014,3,7,7,26,µg/m_,1 Hr,Valid
Shanghai,PM2.5,3/7/14 08:00,2014,3,7,8,19,µg/m_,1 Hr,Valid
Shanghai,PM2.5,3/7/14 09:00,2014,3,7,9,21,µg/m_,1 Hr,Valid
Shanghai,PM2.5,3/7/14 10:00,2014,3,7,10,20,µg/m_,1 Hr,Valid
Shanghai,PM2.5,3/7/14 11:00,2014,3,7,11,17,µg/m_,1 Hr,Valid
Shanghai,PM2.5,3/7/14 12:00,2014,3,7,12,20,µg/m_,1 Hr,Valid
Shanghai,PM2.5,3/7/14 13:00,2014,3,7,13,-999,µg/m_,1 Hr,Missing
Shanghai,PM2.5,3/7/14 14:00,2014,3,7,14,33,µg/m_,1 Hr,Valid
Shanghai,PM2.5,3/7/14 15:00,2014,3,7,15,13,µg/m_,1 Hr,Valid
Shanghai,PM2.5,3/7/14 16:00,2014,3,7,16,17,µg/m_,1 Hr,Valid
Shanghai,PM2.5,3/7/14 17:00,2014,3,7,17,17,µg/m_,1 Hr,Valid
Shanghai,PM2.5,3/7/14 18:00,2014,3,7,18,22,µg/m_,1 Hr,Valid
Shanghai,PM2.5,3/7/14 19:00,2014,3,7,19,32,µg/m_,1 Hr,Valid
Shanghai,PM2.5,3/7/14 20:00,2014,3,7,20,43,µg/m_,1 Hr,Valid
Shanghai,PM2.5,3/7/14 21:00,2014,3,7,21,49,µg/m_,1 Hr,Valid
Shanghai,PM2.5,3/7/14 22:00,2014,3,7,22,54,µg/m_,1 Hr,Valid
Shanghai,PM2.5,3/7/14 23:00,2014,3,7,23,61,µg/m_,1 Hr,Valid
Shanghai,PM2.5,3/8/14 00:00,2014,3,8,0,64,µg/m_,1 Hr,Valid
Shanghai,PM2.5,3/8/14 01:00,2014,3,8,1,69,µg/m_,1 Hr,Valid
Shanghai,PM2.5,3/8/14 02:00,2014,3,8,2,79,µg/m_,1 Hr,Valid
Shanghai,PM2.5,3/8/14 03:00,2014,3,8,3,77,µg/m_,1 Hr,Valid
Shanghai,PM2.5,3/8/14 04:00,2014,3,8,4,72,µg/m_,1 Hr,Valid
Shanghai,PM2.5,3/8/14 05:00,2014,3,8,5,66,µg/m_,1 Hr,Valid
Shanghai,PM2.5,3/8/14 06:00,2014,3,8,6,51,µg/m_,1 Hr,Valid
Shanghai,PM2.5,3/8/14 07:00,2014,3,8,7,48,µg/m_,1 Hr,Valid
Shanghai,PM2.5,3/8/14 08:00,2014,3,8,8,29,µg/m_,1 Hr,Valid
Shanghai,PM2.5,3/8/14 09:00,2014,3,8,9,49,µg/m_,1 Hr,Valid
Shanghai,PM2.5,3/8/14 10:00,2014,3,8,10,39,µg/m_,1 Hr,Valid
Shanghai,PM2.5,3/8/14 11:00,2014,3,8,11,28,µg/m_,1 Hr,Valid
Shanghai,PM2.5,3/8/14 12:00,2014,3,8,12,27,µg/m_,1 Hr,Valid
Shanghai,PM2.5,3/8/14 13:00,2014,3,8,13,22,µg/m_,1 Hr,Valid
Shanghai,PM2.5,3/8/14 14:00,2014,3,8,14,20,µg/m_,1 Hr,Valid
Shanghai,PM2.5,3/8/14 15:00,2014,3,8,15,24,µg/m_,1 Hr,Valid
Shanghai,PM2.5,3/8/14 16:00,2014,3,8,16,23,µg/m_,1 Hr,Valid
Shanghai,PM2.5,3/8/14 17:00,2014,3,8,17,27,µg/m_,1 Hr,Valid
Shanghai,PM2.5,3/8/14 18:00,2014,3,8,18,37,µg/m_,1 Hr,Valid
Shanghai,PM2.5,3/8/14 19:00,2014,3,8,19,38,µg/m_,1 Hr,Valid
Shanghai,PM2.5,3/8/14 20:00,2014,3,8,20,37,µg/m_,1 Hr,Valid
Shanghai,PM2.5,3/8/14 21:00,2014,3,8,21,38,µg/m_,1 Hr,Valid
Shanghai,PM2.5,3/8/14 22:00,2014,3,8,22,32,µg/m_,1 Hr,Valid
Shanghai,PM2.5,3/8/14 23:00,2014,3,8,23,40,µg/m_,1 Hr,Valid
Shanghai,PM2.5,3/9/14 00:00,2014,3,9,0,41,µg/m_,1 Hr,Valid
Shanghai,PM2.5,3/9/14 01:00,2014,3,9,1,48,µg/m_,1 Hr,Valid
Shanghai,PM2.5,3/9/14 03:00,2014,3,9,3,53,µg/m_,1 Hr,Valid
Shanghai,PM2.5,3/9/14 03:00,2014,3,9,3,55,µg/m_,1 Hr,Valid
